	sentence	label
2585	Un film pour les fans des films brutaux où il ne faut pas trop réfléchir.	0
2787	Kramer contre Kramer est un film intéressant car il traite de la séparation d'un couple marié et de leur déchirement pour obtenir la garde de leur enfant.	1
3923	des images de scènes palpitantes.  j'adore et à acheter absolument.	1
3457	"Alors que l'intrigue s'annonce interressante, on tombe rapidement dans les cliches ""Kassovitz"", comme les gendarmes en train de picoler de la biere pendant le service."	0
2843	Les souvenirs d'enfance de Marcel Pagnol sont exceptionnels parce qu'au fond ils racontent tous les souvenirs d'enfance d'enfants heureux.	1
291	Je parle là de raisons de faire chauffer sa CB.	1
862	Je n'ai même pas réussi à parvenir à la fin tellement je m'ennuyait.	0
494	j'ai aimé ce livre car l'histoire était très intriguante,j'ai moi même essayé d'élucider le mystère et lorsqu'à la fin Rouletabillerévèle la vérité, je suis restée bouche bée.	1
3088	pourquoi un livre aussi original a-t-il été aussi mal adapté?.	0
4363	comment peut on raisonnablement mettre 5 étoiles à ce groupe prétentieux qui n'amène rien de nouveau et qui à coup sûr decevra son public dans 2 ou 3 albums (comme toutes les nouvelles sensations rock qu'on nous présente depuis the strokes).	0
148	C'est un livre très agréable et facile à lire,abordable pour des non initiés.	1
3346	C'est cher 9.99 Euros pour une entrevue de 12 minutes.	0
2310	Il me reste encore plus de 200 épisodes à acquerir mais ce premier coffret est un régal.	1
3775	Chère Clarice, Après un état d'hibernation, je suis de retour.	0
5435	Je viens d'écouter Medulla,il m'a fait l'effet d'un coup de poing dans le ventre.	1
2554	En ce qui me concerne, j'avais très envie de voir ce film dont la majorité des critiques se voulaient plutôt positives.	0
4302	"Si vous avez aimé Depeche Mode à la fin des années 80 et adoré leur album ""Violator"", cet album vous plaira."	1
3510	J'ai vraiment ete decue, et pourtant j'aimais beaucoup ce qu'ils faisaient a l'epoque de la grosse emission.	0
2769	Le commandant japonais d'un camp de prisonniers anglais a reçu la mission de construire un pont.	1
4598	C'est vraiment du gâchis.	0
147	Fabrice Bourland a imaginé dans son Fantôme de Baker Street un duo d'enquêteurs sympathique dont la ressemblance avec les mythiques Holmes et Watson n'échappera à personne.	1
609	Le dictionnaire manque souvent de mentionner la signification de la racine latine ou grecque, ce qui rend l'explication stérile.	0
3387	Un héros décérébré au charisme d'une huître même pas fraiche, des méchants caricaturaux, des dialogues inéxistants et des scènes d'actions absoluments hilarantes de prétention.	0
2515	2 étoiles sur 5, ce n'est pas pour la série, mais le boitier, le coffret cartonné, qui est très mal fabriqué.	0
1133	Ce livre est une accumulation de bêtises à caractère soi-disant religieux et scientifique.	0
799	"à travers cette enquête rondement menée,on apprend que la question ""brûlante"" du pétrôle( mauvais jeu de mot."	1
3416	Voici un coffret bien sympathique de certains des films essentiels de la belle Audrey (mes chouchous étant ici Sabrina et Diamants sur canapé) pour un prix mini-mini.	1
2997	"A ma grande surprise je regarde "" Les petits Einstein "" avec ma petite fille de 21 mois."	1
4136	Cette compilation bénéficie d'une bonne idée : la présence de trois titres des Beatles joués pour le Bangla Desh Concert.	0
459	Franchement, j’ai été un peu deçu de ce livre don’t j’avais entendu parler comme le chef-d’oeuvre de Voltaire.	0
2923	"Mix de   (pour la surenchère d'effets spéciaux) et de   (pour la philosophie de comptoir), ""Wanted"" est un blockbuster sans plus d'intérêt qu'un autre blockbuster du même type, servi par un Morgan Freeman en roue libre et une Angélina pas si Jolie que ça, et porteur, en outre, d'une morale des plus douteuses, en plus de participer à la banalisation de la violence."	0
2559	autant le premier film était novateur et pouvait laisser espérer une suite sympathique, autant les délires ici (l'architecte, Lambert Wilson et Monica Belluci, toujours aussi pot-de-fleur) sont indigestes.	0
5953	Pas facile de poser un regard objectif sur un nouvel album de Trust tant ce groupe continue d'entretenir avec tous ses fans des années 80' un lien particulier.	0
3408	Dans ce western, Anthony Quinn crève l'écran dans son rôle de bandit sanguinaire et analphabète.	1
2818	Ce film vaut bien un petit détour.	1
4686	Avishai Cohen m'ennuie.  C'est certainement un très bon musicien.	0
5476	Ce dernier disque des fatals picards est de loin leur meilleur! Les textes sont toujours excellents voire même meilleurs qu'avant, au niveau musicale le groupe s'est également nettement amélioré  Au niveau des chansons, le groupe touche à tout les sujets de la vie de tout les jours (politique, gothiques, emploi, jeux.	1
788	Par ce livre essentiellement axé sur la religion des cathares, l'auteur nous dévoile le livre des deux principes : le bien et le mal ; il nous délivre l'essentiel de cette philosophie qu'il analyse avec circonspection.	1
2449	ENCORE ET ENCORE.CHAQUE SAISON DES SIMPSON EST UNE SACRE PARTIE DE RIGOLADE ET DE DIVERTISSEMENT.	1
5346	"Je trouve moi aussi que le ""Green Album"" n'a pas de quoi fouetter un chat, ok ""Hash Pipe"" et ""Island In The Sun"" sont 2 singles sympas mais loins derrière les très bons ""Buddy Holly"" ou ""Say It Ain't So"" (pour ne citer qu'eux) du premier album ! Pinkerton m'avait déjà un peu déçu mais je suis là je suis carrément dégoûté d'avoir acheter un CD d'à peine 29 minutes pour un tel résultat ! Repassez-vous plutôt ""The Blue Album"" !"	0
4738	Quoi? oui, c est une référence.  Jamais vu des artistes avec un talent aussi prononcé en musique.	1
3173	L'idée de départ est amusante, et donne lieu à quelques bons gags, et certains moments dramatiques bien vus.	0
2414	Je m'associe à 100% aux commentaires que j'ai lus sur le site.	0
5222	On peut dire que la carrière d'Yngwie se divise en plusieurs époques.	1
857	Cet excellent roman, sous couvert d’enquête policière, nous donne une vision touchante et sensible du passage de l’enfance à l’âge adulte.	1
3861	Autant j'ai adoré Ghost Dog, du même réalisateur, autant j'ai trouvé Dead Man ennuyeux et outrancier.	0
27	Louis, apparemment ancien flic, trouve dans un excrément de chien un os de pied humain.	1
4224	l'attente a été tres tres longue mais le voila enfin le cuban vol 2 tant attendu et qu'elle suprise cette album est le classic attendu par tous vraiment je vous conseil l'achat sans aucune reflection du vrai du pure son new yorkais des prod de j-dilla, dr dre marley marl enfin bref un bijous du rap us vient d'arriver	1
2132	"Quel gachi après les 3 premiers! Je n'ai pas pu tenir plus de 5 min devant ce film tellement il est nul ! çà bouge,certes mais on ne sait pas pourquoi, aucune intrigue; il vaut mieux regarder ""plus belle la vie"" à la télé , franchement ."	0
1360	La lecture est très fluyde et intèressante, mieux qu'un thriller pour un titre qui en Italie est dèsormais hors catalogue.	1
1922	mon fils grand fan des animaux et en particulier des félins l'a littérallement dévoré .	1
3243	Je ne parlerai pas du film contre lequel je n'ai absolument rien à redire (si ce n'est que la VF ainsi que les ST sont appriximatifs) mais du support.	0
958	L'errance morbide d'un anti héros à travers une Amérique déphasée et dépendante.	0
990	Qu'il est bon de retomber parfois en enfance. J'ai découvert ce merveilleux conte avec un infini bonheur.	1
5097	L'un des meilleurs albums des Cramps , bizarrement pas encore chroniqué ( alors je m'y colle ne serait - ce que pour rendre hommage à Lux Interior ) .	1
1008	Quel génie de donner à l'homme préhistorique la pensée de l'homme d'aujourd'hui.	1
1802	histoire très plate,héroine très mièvre, je n'ai pas été captivé, ni de finir ma lecture.	0
5292	découvert lors d'une décentralisation du NJP (Nancy Jazz Pulsation) j'ai été transportée par ce trio .ambiance africaine, urbaine,indienne, .	1
4926	En tant que grand amateur de jazz et de musique en général, tous genres confondus, je tiens à dire que cet album n'a strictement rien de jazzy ( Mon vieux Charly Parker, si il en tendait dire que N.	0
4298	Bon il est vrai qu'alicia keys nous proposait avec song in a mior un album qui sortait de ce que l'on connaissait deja du RnB,mais la,elle s'imite elle meme en nous donnant vraiment une copie de son premier album,en se reproduisant elle perd de son originialité,et de la surprise qu'avait sucité son premier cd,certes quelque titres sont assez bon,mais pour quelqun qui aurait deja trop ecouter le premier,le second produirait une overdose je pense :/	0
177	C'est peut-être uen méthode syllabique, mais elle n'est pas facile d'accès.	0
3166	***** En ce qui concerne les derniers jours d'Hitler dans son bunker, comment savoir ce qui c'est réellement passé ? ***** Ce FILM DVD apporte une des réponses, est-ce que c'est la bonne ? L'on sait qu'Hitler s'est marié avec EVA BRAUN et qu'ils se sont suicidés puis ont étés brûlés sur l'ordre du FHÜRER, juste avant sa mort ! En tout cas l'on ne s'ennuie pas du tout ! Grace à ANTHONY HOPKINS ! Il joue là son rôle le plus terrifiant de sa carrière car qu'y a-t-il de plus terrifiant qu'Adolf HITLER au 20ème siècle ? Durant la seconde Guerre mondiale ? Il croyait à un REICH de mille ans, ce dernier est mort en même temps que lui quasiment *****	1
2130	Excellent film a voir au moins une fois!  Cette comédie est plus qu'hilarante avec d'excellents acteurs.	1
732	Après avoir lu ce livre, dois dire que j'ai un regard bien différent sur ce que j'achète.	1
385	"Encore un clone particulièrement poussif de la ""Génération Coben"", et une nouvelle variation autour du thème, pourtant déjà usé jusqu' à la corde, du personnage sans histoires qui voit son existence parfaitement paisible et ordinaire basculer d' un seul coup vers le cauchemar, suite à un message reçu (ici, une photo) qui lui révèle que sa vie entière n' est que mensonges et faux-semblants."	0
3974	Je l'ai regardé hier soir j'ai hate d'y retourner,  la seule chose que je regrette c'est qu'il n'y ai pas  les groupes de tete d'affiche (motorhead,slayer,bleeding through,job for a cowboy et bien d'autre.	1
5517	Cassandra me plait dans Blue Light 'Til Dawn, New Moon Daughter &amp; Belly Of The Sun.	1
243	Des journalistes du Monde à la sauce Voici.	0
4006	Lorsque Muse a sorti son  , le choc a été grand: pop, rock, lyrique, un trio anglais retrouvait la force du   de Radiohead avec le lyrisme de   de Jeff Buckley.	0
5069	Cet album est un veritable chef-d'oeuvre à reserver au oreilles avertis et au fan de Marillion, je pense que L'AUDITEUR DE NANTERRE ,n'a pas bien ecouté cet album c'est la referance periode STEVE HOGARTH.	1
1121	C'est le tout premier livre de D. Gemmel que j'ai lu.	1
4101	Rien dire, sauf que cette chanteuse n'a rien apporter à chanson française, même A.	0
4219	Mieczyslaw (Moishei) Weinberg (Vainberg) est né en 1919 à Varsovie.	1
458	Je crois que je n'ai jamais eu à ce point l'impression de m'être fait avoir.	0
4523	"pourquoi faire de cette chose un classique? cet album sent le fric et l'abus, pour un album de punk c'est le pire qu'on puisse faire!  finalement on est pas si loin de la réalité sur la pochette de ""some product carri on""."	0
1857	"La série des ""Jeeves et Wooster"" fait partie de mes livres favoris."	1
5878	Boston était (je dis bien était) une perle dans l'univers du rock, tant par l'originalité de ses productions que par leur rareté .	0
1122	"A travers ce livre, on trouve un homme qui plaisante, qui n'hésite pas à tourner en ridicule les ""philosophes officiels"" fumeux."	1
1968	Comme beaucoup d'ouvrages, dès qu'il s'agit des druides, nous avons droit à beaucoup d'affirmations, mais peu de confirmations.	0
1704	N'apporte strictemant rien de plus de ce qui est connu. SANS INTERET.	0
3338	la qualité du son est plus que médiocre.	0
5536	On pensait que Billy C.	1
1108	Un de mes défauts : faire confiance aux autres ! Ainsi, j'achète tous les Prix Hugo, considérant qu'ils récompensent les meilleurs ouvrages de SF du moment.	0
2717	scatologique, bête et ennuyeux, sans doute pas compris le message s'il y en a un, j'ai trouvé ça insupportable au bout d'un quart d'heure.	0
1025	Depuis longtemps, les fan attendaient de Christian Bourgeois qu'il éditât en un seul volume bilingue les poèmes complets de James Douglas Morrison, jadis éparpillés entre cinq livres.	0
1000	Après avoir lu tous ses livres, j'étais plus qu'heureux que l'on m'offre celui-ci alors que d'habitude j'attend l'édition de poche.	0
3351	Ce concert est le meilleur hommage qui puisse être rendu à cette remarquable chanteuse qu'est Céline Dion.	1
5684	Ce second opus du trio sud est magnifique, que ce soit sur les compositions originales ou sur des compositions revisitées.	1
1816	Ce livre raconte l'itinéraire d'un français né d'une mère musulmane, devenu adepte de mystique soufie à vingt ans puis musulman non pratiquant à trente ans.	0
4528	Dévastateur !!! L'effet que produit les morceaux de ce disque est irrésistible.	1
3054	Cette série est excellente comme série historique : assurément du jamais vu, malgré ses quelques arrangements historiques (la mise à mort de Vercingétorix qui n'a en réalité pas eu lieu, etc.	0
3431	C'est une honte d'avoir autorisée la sortie de ce film où Bruce Lee n'apparaît quasiment pas.	0
3681	L'histoire : Jonathan Rivers (Mickael Keaton), architecte, perd sa femme dans des circonstances mystèrieuses.	0
3945	Même pas drôle, je suis pas prêt d'acheter ce film de beauf ! Obligé de mettre une étoile sinon le commentaire n'est pas en ligne ! Ca en vaut pas une seule !	0
2005	J'ignorais que Dexter avait été mis à l'écran, j'ai donc été heureux de le découvrir en surfant sur amazon, les deux romans publiés en poche m'avaient emballé, par une bonne combinaison entre le rythme du récit, l'humour décalé et une bonne gestion du suspens.	1
3509	Si vous êtes fan de cette superbe BD qu'est Spawn , passez votre chemin , il n'y a rien à retirer de ce film , réalisé trop tôt .	0
3333	J'ai adoré voir Cali sur Scène mais après nous avoir décu avec un tout léger CD LIVE, voilà qu'il nous décoit encore plus avec ce DVD qui est pas beau du tout.	0
4348	Des Picards hélas en manque(que nous espérons tous temporaire) de matériel exploitable.	0
422	Que s'est-il passé?  Avec le tome 1 on pouvais apprécier un humour désinvolte et une poésie urbaine rafraichissante.	0
3538	Un chefs d'oeuvre. y'a pas d'autre mot pour le dire. Hilarant d'un bout a l'autre.	1
5348	"Je trouve moi aussi que le ""Green Album"" n'a pas de quoi fouetter un chat, ok ""Hash Pipe"" et ""Island In The Sun"" sont 2 singles sympas mais loins derrière les très bons ""Buddy Holly"" ou ""Say It Ain't So"" (pour ne citer qu'eux) du premier album ! Pinkerton m'avait déjà un peu déçu mais je suis là je suis carrément dégoûté d'avoir acheter un CD d'à peine 29 minutes pour un tel résultat ! Repassez-vous plutôt ""The Blue Album"" !"	0
2873	By now you know everyone thinks this is one of the greatest movies in the cinema.	1
312	Lady snowblood volume 2 ! Magnifique manga, les auteurs nous font progressivement découvrir la personnalité de la Lady tout en lui laissant son mystère envoutant ! Elle poursuit sa vengeance, pleine de rebondissements que l'on dévore du début à la fin !	1
1877	"It is puzzling why so many of the French have been willing to pay the equivalent of $17 for ""The Horrifying Fraud."	0
1226	"Je n'ai pas découvert ""cette lumière aussi surprenante""de l'éditeur."	0
3907	Superficiel et mal conçu, ce DVD nous offre un simple aperçu touristique pour gens pressés.	0
686	Nicolas Baverez a trouvé un filon: l'apologie de la modernité introuvable, sur lequel il n'est malheureusement pas le seul.	0
848	Mais que c'est beau!!! Tout commence par la mort d'un père.	1
3214	"Avec la promotion faite autour de ce film, les promesses suggérées par le thème et ma sympathie habituelle pour Belmondo, j'attendais un film dans la lignée des ""Magnifique"" ou ""Incorrigible""."	0
2974	j'ai acheté ce film en me basant sur les commentaires et j'ai été scandalisée des libertés prises avec la réalité de la biographie de Beethoven.	0
3691	On connaissait depuis belle lurette les délires pseudo-historico-mystiques du gars Plantard Pierre sur la filiation christique des Mérovingiens et le prétendu « Prieuré de Sion ».	0
2205	Pour moi, la saga scwharzzynator aurait du se terminer sur ce film!Il nous donne une nouvelle image du terminator, changée par John Connor, nous explique mieux l'intrigue sans nous en dire trop, ce film est magnifique &amp; montre comment nous avons ruiné notre futur, très alarmiste mais aussi plein fd'espoir le jeu des acteurs est sensass &amp; ce film est à posséder.	1
3584	Louise Brookes n’était pas encore une grande star de Hollywood lorsqu’elle partit pour l’Europe tourner Loulou.	1
2101	le système de maintien en haleine marche encore mais je commence à me laisser de la justification permanente de la violence et de la torture .	0
2868	Tout le monde connaît Pink Floyd : une ambiance étudiée, une musique pensée à l'extrême, etc.	1
4896	je ne suis pas un adepte des comparaisons !  Mais on la compare souvent à Jon Mitchell, et c'est vrai une TRES TRES GRANDE artiste de cette nouvelle génération qui confirme qu'avec des choses simples on peux faire des choses EXTRAORDINAIRES.	1
4410	"Franchement ! vous le trouvez bien vous se ""Snif upper lip"" ? ."	0
1967	Une histoire saugrenue, libidineuse et sans surprise qui prétend être fondée sur des faits récents en matière de neurologie, mais qui repose surtout sur des spéculations paranoïaques et pseudo-scientifiques.	0
756	Je viens de terminer (hier) le dernier roman de Patricia Cornwell.	0
5804	"""Suite logique"" de son E.P ""Eyes Closed"", ""Muted"" marque un tournant dans la carrière de Brendon Whitney, aka Alias."	1
4644	J'avoue que je ne connaissais pas cet artiste, seulement entendu parler de lui j'ai donc acheté son best off et on peux dire que cela a été une confirmation de ce que j'avais entendu sur lui et sur son oeubre un grand monsieur, des sons qui vous permettront de voyager dans ce fascinant continent qu'est l'afrique.	1
427	Elizabeth George a tous les traits d' Agatha Christie...	1
1518	Ce livre pour moi ne présente que peu d'intérêt: l'histoire n'est pas vraiment originale, mais surtout son grand défaut est qu'il repose sur l'idée de destinée qui ne m'a pas particulièrement plu.	0
3788	Un film Merveilleux, vraiment Merveilleux, exceptionnellement Merveilleux, si Merveilleux.  Des séquences Emotions, vraiment Emotions, purement Emotions, tellement Emotions.	1
4072	Cet album est une vraie merveille.	1
1201	Deux étoiles pour le ton humoristique. Mais attention à ne pas confondre ce livre avec quelque chose de sérieux.	0
438	Dans le précédent volume, Henri III signait de façon plus ou moins forcée le traité de Nemours, en faveur de la religion catholique et l'extermination des Huguenots.	1
5386	Une chose est sûre: cela ne ressemble en rien à ce que Jean-Michel Jarre a fait dans le passé.	0
3120	C'est sans doute l'un des deux films les plus mal aimes de Spielberg (avec l'etonnant 1941), et on se demande pourquoi.	1
2350	Dans The Hours, 3 femmes du 20ème siécle (début, milieu et fin) aux destinées et aux caractères différents partagent un même sentiment de noyade quotidienne, d'oppression, de dépression.	1
2400	Méme si cette nouvelle mouture est relativement agréable , elle n'arrive pas à la cheville de l'original .	0
3311	Soyons clairs, les premiers épisodes sont très mauvais (les 4 premiers); entre scénario ridicule, personnages ultra-caricaturaux,voix off insupportable, et clins d'oeil à outrance de Kristanna Loken, on croit rêver.	0
1254	Voilà un livre vraiment pour les tout petits(à partir de 6 mois).	1
233	Comme beaucoup de romans américains à la mode, l'accroche et le début intéressent, puis ça s'épuise franchement, pour terminer en queue de poisson totalement irréaliste .	0
3964	Fervent admirateur de la trilogie je dois avouer avec depit que Lucas a oublié de penser à un  scénario entretemps.	0
1515	Ce petit dico, ainsi que son inverse, ont été mes premiers dicos.	0
1800	Il existe beaucoup de livres et parfois on ne sait pas lesquels choisir.	1
5375	Ce n'est à la base pas mon univers mais bon sang quelle claque.	1
1030	"Je me réjouissais de lire ce livre, mais je ne suis jamais vraiment ""rentréé"" dans le live."	0
2183	Film musical culte mené tambour battant par Jake et Elwood Blues afin de reconstituer leur jazz band déchu pour effectuer une tournée à travers l'Amérique populaire afin de sauver leur orphelinat et conclure par une incroyable course poursuite dans Chicago au volant de leur Dodge Monaco 1974  (la Bluesmobile).	1
403	Peut-être tout simplement le plus beau roman sur la notion de Résistance ! De l'humain sans manichéisme, une belle leçon d'humanité.	1
1127	Magnifique, froid, magnétique, épouvantable, humain, formidable écriture, contestable (discutable?) récit.	1
3999	Que c'est dommage ! Et dire qu'ils étaient sur place pour faire le film.	0
1359	Livre interessant pour en avoir plus pour son argent et pour aider à passer les fins de mois difficiles.	1
5419	Le premier album d'anti-flag, des super lyrics, à acheter sans réfléchir.	1
208	"Bonjour, j'ai 12ans et j'ai lu ""l'Ile du Crâne"", et je l'ai apprécié car il possède de l'action mais surtout du suspense."	1
5887	dans la famille KISS je demande le vampire ! On s'attend à du sang sur les murs, des giclées de décibels et des hurlements sous la lune ? que nenni ! L'ami gene nous fait le coup du jardin secret, en dévoilant des facettes méconnues et inatendues de son talent.	1
4578	Ce coffret a obtenu jadis un Diapason d'Or.	1
4401	Passé le tube Yours hands around my throat, on retombe dans les travers de Death in Vegas : une électro lassante et des créations musicales au fort arrière goût de déjà vu.	0
4682	"Des chansons documents-films sur les indiens, des ballades comme celle connue ""BALLADE OF IRA HAYES"" mais ici avec une intensité plus particulière."	1
240	Je suis en train de lire ce livre, et franchement il est très intéressant, très passionnant, très agréable à lire et surtout très clair.	1
3764	"L'adjectif "" génial "" est, on le sait, sans doute trop souvent employé, si bien qu'il est aujourd'hui totalement privé de son sens original."	1
5518	cet album est indispensable pour tous ceux qui veulent connaitre  errol garner.	1
2491	"Après avoir vu cet excellent film qui ose parler de la réalité de ce qui s'est passé durant la guerre du Vietnam - Il vous faut absolument lire ""American Tabloïd"" du grand écrivain américain qu'est James ELLROY; là, vous trouverez en beaucoup plus développé ces infernales organisation &amp; planification - merci la CIA, la mafia et mr Hoover - de la prise contrôle du marché de l'opium, de sa transformation en bonne vieille héroïne et sa distribution ciblée sur l'Amérique (noire de préférence) Un très bon film, un monument de livre."	1
2186	Ce fait divers sordide d'un couple de tueurs complices, qui séduit par petites annonces les femmes esseulées pour les voler et de les assassiner sauvagement, a déjà inspiré plusieurs films dont l'extraordinaire CARMIN PROFOND d'Arturo Ripstein, à la somptueuse mise en scène d'un rouge flamboyant, transposant l'histoire dans la pauvreté sociale et affective du  Mexique rural, entre dérision et horreur  .	0
2981	l'image est belle, et le film, bien qu'un peu long, est franchement hilarant et délivre un message que certains trouveront naïf mais qui fait du bien.	1
3004	J'ai du voir tous les films existants avec Hilary Duff&amp; c'est le seul qui ne m'ai pas plus .	0
1828	On m'avait dit 'Tu verras, c'est génial, y'a pas mieux!' Ils se sont trompés.	0
2367	Malgré toute la sympathie que j'ai pour Michel Gondry , ce film est un gros ratage .	0
1484	"bien recu rapide efficace
 rien a dire
 si un mot : merci
 cordialement"	1
4065	Ce CD comme, de plus en plus, est protégé par un système destiné à empêcher tout acheteur de disposer à sa guise de ce qu'il a légalement acheté (en faire une copie pour son autoradio, le passer en mp3 pour son baladeur, etc.	0
5046	"David Bowie signe des albums de plus en plus ""ordinaires"". Reality est du domaine du ""aussitôt écouté, aussitôt oublié""."	0
2397	Ha!!!, Harry Potter. Enfin une adaptation cinématographique fidèle à l'ouvrage de référence.	1
2338	Loin de s'émousser avec le temps le plaisir de voir le Dr House en action est toujours plus fort.	1
3130	je n'ai jamais reçu le produit alors que je l'ai payé, personne ne répond à mes mails!!! surtout ne rien lui acheter!!!	0
2504	Tout est dans le titre de ce post, j'ai vecu un calvaire a regarder ce film niais et sans aucun interet, Frot est pourtant une actrice que j'aime et respecte profondement mais la.	0
394	Pour ma part,1 des meilleurs de Marc Lévy car il raconte 1 période historique qui émeut,bouleverse,touche.	1
5490	Indiscutablement, cet album est historique. Dont acte.	0
4053	ou comment le marketing fait prendre des vessies pour des lanternes.	0
4204	"c qu'il avait beau être un ange (encore que cela reste à vérifier car je l'ai pas connu personnellement)ce live montre une fois de + que c'était un chanteur comme tant d'autres
 de la variété bas de gamme, aucune originalité"	0
