	sentence	label
942	Ce livre est très captivant pour un enfant de 8 ans, facile à lire; réveil le désir de la lecture.	0
1473	A mon humble avis ce n'est pas (et de loin) le meilleur roman de Johanna Lindsay, l'intrigue est si mince que sitôt le livre refermé elle est oubliée.	0
4319	"qui oserait dire que cet album n'est pas une pure merveille!!!!!!!!!il viens tout droit du coeur c'est clair je pensais que seul renaud et son mistral gagnant pouvait me faire pleurer mais en fait j'ai quand même versé des larmes de tristesse avec "" tout va bien "" et ""comme un fils"" a la la MERCI CORNEILLE t'es génial"	1
2179	Mes enfants adorent ce super héros alors pour passer une soirée plateau télé avec eux nous avons visionnés le dernier spiderman.	1
4556	La musique est certes correcte mais il s'agit ni plus ni moins d'un pompage honteux de Rachmaninov (notamment sa première symphonie).	0
1508	j'ai essayé de lire ce livre , et je n'ai pu aller plus loin que la page 30.	0
952	c'est un livre intéressant mais d'une approche difficile.	0
5650	"Ce coffret contient 4 CDs, incluants ""a priori"" tous les enregistrements studio et des engeristrements ""live""."	1
1741	The Goon, gorille défiguré, règne dans l'ombre sur une ville déjantée (une sorte de Gotham City en plus rustico-pourri), dont une partie est aux mains des zombies, l'autre à sa pogne.	1
1193	Bravo à Laurent Gaudé pour ce livre sensible et plein d'humanité, qui traite un sujet rebattu par les médias, et qui méritait bien mieux.	1
5632	Après un album plutôt décevant (Brand New Day), Sting remet les choses à plat et synthétise en dix chansons l’harmonie parfaite entre sonorités électroniques, guitares électriques et ambiance jazzy.	1
3056	Voici l'avant dernière saison de cette série formidable. Je trouve que Ilene Chaiken s'est surpassée pour cette saison 5.	1
3692	Oui, bien entendu, il s'agit d'un encore d'un coup de marketing, diront certains: ressortir les vieilles versions que tout le monde attendait après l'édition spéciale (définitive, selon Lucas) avec dans le même pack les nouvelles versions qu'on a déja achetées en coffret.	1
3005	On retrouve a travers ce film des themes clefs de l'oeuvre du cineaste: l'impossibilite de nouer des relations humaines viables et l'alienation moderne, creee par une obligation d'efficacite de tous les instants(la Bourse joue un role symbolique tres important dans le film).	0
1269	A partir de quelques cas, fort bien décrits, de disparition de sociétés, l'auteur prophétise un avenir pour le moins catastrophique pour notre monde.	0
4373	Qu reste-t-il de nos amours ? ici le jazz est réduit à une toile de fond médiocre et insipide.	0
4560	"Ceux qui ne regardent pas plus loin que ""Dirrty"", un titre festif comme seul les américains savent le faire, et son clip sulfureux (Réalisé volontairement pour casser son image de chanteuse pop gentillette) se voilent la face."	1
4279	"Faut il que certains de nos compatriotes aient les conduits auditifs déformés et formatés par des années de  et de  pour faire des stars de ce genre d'artistes et écrire -comme j'ai pu le lire sur cette page- que la miss ""avait un son trés rock""."	0
1829	J.R.R.	1
5498	Dans cet album live, Jay Z confirme son statut de grand rappeur from Brooklyn.	1
4862	Tout d'abord, il s'agit d'enregistrements totalement inédits; et leur qualité sonore est exceptionnelle.	1
4304	Franchement, le groupe revenu au complet devait-il se fourvoyer avec Timbaland et Timberlake aux univers tellement différents ? Ca fait vraiment : je relance les ventes !  Timbaland ayant sorti lui-même un album assez bon    ne peut s'empêcher d'empiétrer sur le terrain de Duran Duran et nous imposer Timberlake lui-même ayant sorti un album assez réussi     Duran Duran commence par deux morceaux assez nuls et se fait voler la vedette par Timbaland qui ne peut s'empêcher de l'ouvrir sur les titres qu'il produit.	0
5467	J'aime beaucoup cet album des Flower Kings! Certains ont regretté l'absence d'epics de 20 ou 30 minutes, pas moi.	1
1906	je pensais retrouver esla linux sous une autre écriture, mais pas du tout, je ne suis pas aller jusqu'au bout du livre, mal ecrit, il est ennuyant	0
1520	Bien, mais dommage pour la transcription phonétique pour l'hindi/ourdou.	0
2359	Voici enfin un excellent film d'anticipation dont le suspense ne fait que croître (et notre curiosité s'accroître) au fur et à mesure de l'avancement de l'intrigue! Sans crier au chef d'œuvre, ce film est à classer parmi les meilleurs de sa catégorie! Le suspense est vraiment garanti et le dénouement est réellement surprenant.	1
3733	"Ce DVD est un chef d oeuvre au meme titre que le film pour la simple raison que les éditeurs n y ont mis que l essentiel : bande originale du film(introuvable en CD aujourd hui),commentaires du réalisateur, artworks définitifs ou inutilisés (il y a même des dessins de Jean ""Moebius"" Giraud inclus) avec évidemment les oeuvres de HR Giger."	1
3659	Le BD n'est pas en cause,l ímage est belle, nette et les couleurs sont naturelles, mais le scenario est pauvre: on devine tout.	0
2323	"Pour qui a vu le magnifique film ""Le fantôme de l'opéra"" de T."	0
3248	Une suite très réussie, dans la même veine que le premier.	1
2731	A acheter sans se poser de questions, ceux qui ne l'ont pas encore ne seront jamais des flaments ils resteront moineaux.	1
1500	"Je ne ferai pas de commentaire sur l'anthologie proposée dans la seconde partie de ce livre mais poserai seulement une question : Pierre Desproges aurait-il approuvé celle-ci, en l'état ?  Quant à la préface et aux ""saluts à l'artiste"" pris dans leur ensemble, quelle déception ! quel vide ! quelle indigence d'esprit ! quel manque de finesse ! quel hommage décevant à Pierre Desproges ! Cela fait une raison de plus de regretter la disparition de ce dernier."	0
3446	J'étais réticente à voir ce film au départ tellement le battage médiatique m'a agacé, et que ce n'est pas parce que c'est le réalisateur du SDA qu'il faut à tout prix dire que c'est une merveille.	1
3394	300 est une sorte de mélange entre du RPG façon Le seigneur des anneaux (le film) et des univers de type jeux vidéos, le tout pour passer à la moulinette l'histoire fantasmée de Sparte.	0
5073	Paroles simplettes, rock de girls band des années 80 à la Pat Benatar, un riff pour les trois quarts de l'album.	0
1839	"plutôt pour les débutants dans l'activité ou les gens qui se posent des questions pour savoir ""comment ça marche l'ostéo?"""	0
3603	Pas d'accord avec votre chronique! Le film est  troublant, depuis le début jusqu'au dénouement, inattendu.	0
1592	"j'avais jubilé à la lecture d'""hygiène de l'assassin"", roman ignoble à souhait, suintant la malveillance par toutes ses pages."	0
4393	"J'avais beaucoup aimé ""Le Fil"", un album frais, plein de fantaisie et qui était réellement touchant (le magnifique ""Pâle septembre)."	0
5875	A déconseiller absolument aux amateurs de Metallica voir aux amateurs de musique tout court  Cet album n'est qu'un enchainement de bruits et de sons sans que l'on arrive à ressortir même une seule chanson du lot.	0
2061	J'adore James Bond 007 mais celui-ci n'en est pas un.	0
514	J'ai offert ce livre à ma mère pour sa fête : elle ne se souvient même plus de quoi ça parle .	0
1561	En achetant ce livre, je trouvais l'idée assez géniale d'imaginer ce qui aurait pu se passer si un certain nombre d'évènements étaient survenus.	0
4949	un album d'anthrax qui mérite l'attention de tout un chacun.	1
2062	"le film Casino Royal avait mis la barre très haute en imposant une sorte de remise à niveau de la franchise ""Bond""; un nouvel acteur, antithèse du dernier avatar, prenant en compte certainement la révolution du côté petit écran avec 24h chrono et son ersatz cinématographique ""Jason Bourne"", voilà, que le nouveau James Bond pouvait revenir conquérir les fans armé de toutes ces nouvelles tendances."	0
191	Ce livre est partisan, mais, en soi, on ne peut pas le lui reprocher.	0
5630	Ca faisait un moment que j'avais arrêté à écouter du heavy car je trouvais que la flamme s'était éteinte à la fin des années 80 et après.	1
4854	"Dans la foultitude de compil estampillées ""new wave"" qui sortent depuis quelques temps, en voici une parfaitement recommandable et à tout petit prix."	1
1362	C'est certainement de ma faute.	0
5310	Vraiment déçu à l'écoute de cette compilation :	0
292	Rien qu'avec le titre, on sait que l'histoire va être très dure, alors on s'accroche.	0
2451	Excellente mise en scène .	1
1401	Court texte sur une trentenaire qui se bat depuis l'enfance sur les préjugés homme-femme, le bien-pensant, l'archétype du couple, la vision de la société sur l'amour ; une femme qui mène le combat d'un féméinisme autrement et sans concession.	0
5862	Ha oui parceque ça hurle sur cette galette !  De belles gueulantes (et de la mélodie aussi bien sur) au service d'un bon heavy très varié, parfois old school 80's, parfois très moderne ou même carrément ballade.	1
1394	Je pense qu'on ne peux pas traiter ainsi des scientifiques qui ont soigné l'ame humaine au lieu de mettre des gens guérissables dans des asiles , combien parmi les auteurs et combien parmi les commentateurs ont suivi une psychanalyse ? je fais un pari : aucun ? ils parlent d'une chose qu'ils ne connaissent pas mais aiment ce titre racoleur ,cette couverture multicolore digne de notre société de consommation et cet air de scandale qui fait que certains journaux se vendent si bien.	0
3989	Les chanteurs sont dans l'ensemble excellents même si, à mon avis, les interprètes de la version de 1957  leur sont très légèrement supérieurs.	1
5800	Soyons clair ce disque n'a rien à faire dans la rubrique du rock progressif, c'est le plus mauvais de GENESIS qui depuis 1977 n'avait plus rien à dire.	0
249	150 petites pages à peine pour ce prix Inter 2006 qui paraît tout juste au Livre de Poche, et je n'ai pas réussi à aller au bout.	0
5132	Y a pas à dire.	0
2035	Peuples de la Terre, votre attention s'il vous plaît!   Keanu Reeves est venu sauver votre planète qui va bientôt s'auto-détruire (pollution ,empreinte carbone, tout ça.	0
731	Depuis que j'ai lu ce livre je vois la vie vraiment différemment.	1
3022	une pure merveille, pleine d'émotion, avec une finesse des graphismes incroyable.	1
4115	Je trouve que cet album est différent des précédents.	1
2988	"Comme la fiche amazon ne l'indique pas, il s'agit ici de l'OAV ""Endless Odyssey""."	0
1217	un livre que j'ai toujours connu dans la bibliothèque familiale, livre référence, malheureusement perdu au cours d'un déménagement.	1
3954	Si effectivement il y a des moments rares, il faut comprendre que ce double DVD est sensé retracè l'histoire du Hard et de toute son évolution.	0
2207	Une animation excellente, des gags géniaux, beaucoup d'émotions, ce film est vraiment une petite surprise de la part de la Fox qui signe là son premier long métrage en images de synthèse et certainement pas le dernier.	1
4354	Cette interprétation est froide et souffre de nombreuses lacunes.	0
3455	"Avant toutes choses je pense que notre cher ami ""Un spéctateur"" à du se planter dans sa note :D"	1
1259	"J'ai découvert il y a peu de temps cette petite collection de ""T'CHOUPI"", que j'apprécie beaucoup."	1
5666	"""Don't step outside"" me dit-on. Suis-je déjà endormi ? Quelqu'un chuchotte dans mon oreille."	1
4215	procurez vous l'enregistrement de kuijken et leonardt.il date un peu,il a des défaut que vous arriverez a pardonner aisément.	0
3950	Toujours aussi agréable à regarder!C'est du grand ANDRE RIEU ! Un tout petit reproche si je peux me permettre, cela n'atait pas du 100% Noël.	1
3693	La suite du chef d'oeuvre de Don Bluth ne porte pas la signature du maître et pour cause:le dessin et l'animation sont de moins qualité que le premier opus mais surtout la richesse scénaristique a disparu au profit d'une histoire linéaire.	0
322	"J'ai d'abord lu ""petit arbre"" du même auteur, un ""petit Prince"" indien. Un indispensable pour tous les ages."	1
3009	Un style, un langage cinématographique qui fut utilisé par d'autres réalisateurs mais initié par le maître, une touche de classe et des histoires    aux rebondissements surprenants, Hitchcok est le Léonard de Vinci du cinéma.	1
5819	je résumerais ainsi ce nouvel album que nous offre Prince.	1
2134	"Villeret et les autres acteurs n'arrivent pas à alléger, et c'est pas faute d'essayer, le fardeau ""relou"" qu'est Michael Young, excité, vociférant, tonitruant, fidèle à lui-même, dénué de tout talent."	0
3337	Que rajouter aux commentaires des internautes précédents? Tout est dit.	1
2886	ce film parvient avec un brio inédit à mélanger romantisme, action, politique et scénario rythmé à rebondissements.	1
3543	La performance des deux acteurs principaux est ce qui sauve ce film.	0
3087	Lamentable, pitoyable, vide intersidéral. seule la scène de la tente de camping peut décrocher un léger sourire crispé.	0
2895	This is a Christmas story that may have a more Halloween feel. Shep Henderson takes a new apartment.	1
66	Dès Tintin au Congo, Hergé avait été accusé de condescendance envers les populations colonisées d'Afrique.	1
3503	Le festival de Monterey est LE festival inaugural de l'histoire du rock.	0
1311	Une analyse intéressante des influences des énergies des chakras sur le corps physique et les maladies.	1
5299	Le prix des disques de la Platinum Collection de Warner en fait a priori des produits attrayants sur un écran d'ordinateur mais, croyez moi, il s'agit d'une petite arnaque.	0
5060	comment faire pour vous procurer un pur son pop - rock ? le CD dont vous ne serez pas deçus d'avoir.	1
5855	Ce disque est tout simplement nul. Rien de plus à dire. Les textes sont faibles, faciles. Dommage.	0
5259	je ne pense pas qu'il existe de mauvais albums contrairement à certains,tout dépend de quel point de vue on se place(celui de l'adolescent,ou celui de l'artiste expérimenté).	0
689	Le problème, c'est que M. Jacques Marseille est, au même titre que MM.	0
5889	"Je préfère écouter : ""WEATHER REPORT"", ""MAHAVISHNU ORCHESTRA"" etc."	0
1836	Le Dr Jekyll est un grand scientifique, chimiste et fait partie de la haute société londonienne.	1
3432	Un grand classique mais vaut-il vraiment le coup de payer aussi cher ?	1
3290	Ce film est ennuyeux à souhaits.	0
1177	Je suis très déçue par ce livre, son contenu ne reflète pas du tout la promesse de son titre.	0
2126	Tous ceux qui ont vu un film de Michael Haneke savent que son cinéma est systématiquement provocateur.	0
5978	C'est un album intérèssant pour les collectionneurs,mais musicalement je le déconseille au amateurs de mélodies de John Lennon ou des Beatles.	0
2815	Image (mpeg 2, une honte!!) très granuleuse à peine meilleure que le DVD et zéro bonus (ah si!! une pauvre bande annonce, c'est maigre!!!).	0
2401	La plupart des critiques ont vu ce remake comme un véritable sacrilège, mais plutôt que de le voir comme un simple remake, appréciont le pour ce qu'il est, un divertissement populaire ! Comment ne pas vibrer devant les cascades, et fondre devant la magnifique Penelope Cruz, dans la bouche de laquelle les mots doux les plus ridicules prennent une tout autre dimension.	1
2837	Ces épisodes originaux de Star-Trek qui ont été remastérisés sont excellemment nets et le coffret métal est trés beau.	1
2822	I dind't like this film.	0
5327	Rock expérimental, planant et sensuel.	1
20	La vérité, c'est que Sente est un gros mauvais.	0
3912	bonjour a tous je vous recommande ce film de tf1 chasse a l homme super film avec richard berry la vie de mesrine vraiment film reussi tout comme mesrine avec nicolas silberg	1
3418	Je dois dire qu'à première vu, et connaissant bien sur la célébre série télévisé (certes fort divertissante), voir se film semblait etre la dernière de mes préoccupations.	0
3035	Tellement, tellement déçue par le film.  J'ai adoré le livre, mais le film est décevant comparait au roman.	0
441	Rien d'exceptionnel dans ce roman, qui pourtant s'arrache en librairie et souvent en rupture de stock.	0
2122	Enfin un film qui nous remue, qui nous fait bouger, qui nous pousse à réfléchir! Ici, tout passe à la moulinette.	1
3643	l'épisode 1 était déjà une grosse déception mais était tout de même regardable.	0
5231	"Les critiques visent toujours les meilleurs , et la vérité c'est que Madonna est une artiste internationale de divertissement et dans ce rang elle est au top , sur cette album elle se régale sur les production de Timberland , The Neptunes et autres et montre sa polyvalence quelquesoit les styles et les époques , moi qui écoute plutôt du rap , j'ai toujours respecté Madonna et aujourd'hui encore plus , mon morceau préféré "" beat goes on "" et puis le tube "" give it to me "" ."	1
3390	The quality of the normal Zazie dvd is quite OK, even though there are digital and compression mistakes clearly visible.	0
3064	Ce film vous fera passé un bon moment puisque l'action y est omniprésente, outre le faite de la critique guerre et religion il reste souvent assez comique dans les têtes qui explose ou même les bras découpés certaine scènes sont tout bonnement hilarantes.	0
2761	Visiblement Stephen King est un grand angoissé. Le film tiré de l'un de ses romans, s'avère une bonne surprise.	1
5485	Fan de la série après avoir acheté les deux premiers volumes, je m'attendais à mieux de la part du troisième opus.	0
4121	Du lourd, du trés lourd ! Madonna ne fait pas dans la demi mesure (une fois encore).	1
4378	david est toujours égal à lui meme. très bel album. les paroles sont touchantes émouvantes. .	1
3170	Voici un film bien médiocre et bien prétentieux. Il présente en outre le défaut d'être interminable.	0
638	J'ai mis bcp de temps à m'embarquer dans ce livre.	0
1229	C'est un livre génial, c'est un livre qui se dévore.	1
5370	Loin des résidus technoïdes sans âme qu'on essaye de nous faire ingurgiter de force, voici un album résolument moderne et humain portés par une chanteuse de talent.	1
1581	Le narrateur, homme lambda, en vient, presque par accident, à tuer des «cons».	0
1221	Très beau livre, très bien expliqué , nombreuses techniques pour fabriquer des clôtures en bambou .	1
1318	Qui n'a jamais revé d'aller visiter Yzorderrex, la ville de toutes les surprises, capitale de l'imajica.	1
4649	"La musique du film moulin rouge est tout a fait féerique et magnifique ,les acteurs chantent merveilleusement bien et les chansons sont tout a fait époustouflantes, le second cd vient a merveille compléter le premier!A mon avis les plus belles chansons de ce CD sont ""Roxanne"" et ""Come what may"" et sur le cd 2 ""the show must go on"" mais vraiment si vous n'avez pas vu Mouli Rouge allez le voir !"	1
534	Témoin d'un violent accrochage entre deux automobilistes, Jackson Brodie, dont nous avons connaissance dans La Souris bleue, va se trouver lancé dans une série d'aventures incroyables.	0
5290	Voila une compilation de James Brown à la hauteur,une selection de quelques unes de ce qu'il a fait de mieux sur la musique qui l'a lui même crée la funk.	1
248	Un des plus beaux livres que j'ai eu l'occasion de lire.	1
135	Campagne anglaise au début du dix neuvième siècle, au grand désespoir de leur mère, aucune des 5 sœurs Bennet n a encore trouvé de mari.	1
2458	Un jeune cascadeur (lamentable !) veut faire un saut à priori impossible dans le but de gagner la somme pouvant sauver son beau père.	1
41	"Comme beaucoup je me suis ""jetée"" sur La consolante dès sa sortie car j'avais adoré Ensemble c'est tout."	0
880	Ancienne fan de Bernard Werber, je me suis empressée d'acheter l'arbre des possibles, espérant y retrouver toute la richesse de ses premiers romans.	0
2111	cette suite de Cendrillon est adorable, nos petites souris préférées sont de retour et toujours dévouées à Cendrillon.	1
2560	C'est l'histoire de deux adolescents obsédés par le sexe et la télévision, que des agents du FBI prennent pour des espions.	0
967	Les commentaires élogieux m'ont convaincue d'acheter ce livre.	0
652	Sans répéter la justesse des commentaires précédents, on est d'abord frappé par la modernité des personnages qui sans la période 14-18 et celle de l'entre deux guerres, font singulièrement penser aujourd'hui à ces jeunes traders brillants, arrogants, insouciants, sans morale: un sentiment d'indestructibilité jusqu'au moment ou la machine s'emballe.	1
3294	"Synopsis :  Eternel ado de 51 ans, délaissé par son   et une mère absente, Brice s'est réfugié dans une posture, un ""style"" avec lesquels il exprime  , son véritable vécu intrinsèque."	0
4651	une fois décédé, c'est à ce moment qu'il vend le plus, c un peu malheureux quelque part  mais pr être honnête, cela ne casse pas la baraque.	0
4870	l y a des musiciens qui traversent -inexplicablement-mal des frontières aussi ténues que la Manche ou les Alpes.	1
4077	Enfin un artiste de R&amp;B français qui se démarque des Willy Denzey, Wallen, Jalane et autres Leslie.	1
3705	L'intérêt du dvd, c'est d'avoir plusieurs langues et sous-titres.	0
1959	Bouquin fantastique sur la reine pomme de terre, son hitoire, ses variétés, quelques recettes interessantes de tres grands chefs.	1
3637	Dommage qu'un tel film, à la fois beau et original soit gaché par cette édition dvd désastreuse ! Un master qui a mal vieilli (taches et autres poussières) Une appelation HD qui n'a de HD que le marketing auquelle elle se rapporte.	0
4249	Ce nouvel album va surement en dérouter plus d'un : au contraire des albums précédents, plus toniques, au son relativement commercial et proche d'autres groupes comme Radiohead, cet album est éclectique, plus raffiné.	1
4264	Bizarrement, au travers des commentaires, personne n'a simplement remarqué à quel point la voix de Jason Lytle, ex-Grandaddy, était encore plus déchirante qu'auparavant.	1
2258	Si Tobey Maguire est une bonne surprise avec son physique d'anti-héros, le bouffon vert est un des méchants les plus ridicules de l'histoire du cinéma (talonné de près par le surfeur d'argent).	0
1557	Effectivement la première partie de ce livre est fort intéressante, l'on plonge dans l'univers d'un SS pas forcément comme les autres.	0
182	Enfin un cahier de vacances pour adultes! Depuis le temps, on avait oublié les joies de ce petit cahier si cher à notre enfance.	1
1295	Comme la plupart des commentateurs je suis déçue par ce livre.	0
5677	ah mais que de regrets.	0
4875	Le ver est dans le fruit depuis déjà quelques temps - malgré les excellents Chinatown et Renegade- et Phil Lynott a remplacé l'étincellant Snowy White par John Sykes.	0
5971	Insulte aux fans. À Serge. Aux interprêtes mêmes.	0
1397	"Un bon roman de Dostoïevsky, si on le compare à d'autres romans du même auteur, tels que ""Crimes et chatîment"" ou ""Les démons""."	1
3021	Detective Del Spooner (Will Smith) is not a fan of robots and on the surface looks like he does not believe they are as benign as advertised.	1
564	désolée d'amener un son discordant au milieu de ce concert de louanges.	0
1702	Ce livre est un véritable guide au quotidien pour les personnes souffrant de troubles du comportement alimentaire.	1
4869	On tient sans doute dans ce disque l'opus le plus abouti et le plus cohérent de la seconde partie de la carrière du poète canadien.	1
2277	Eh Bien .	0
4457	Cet album illustre parfaitement le fait qu'un artiste connu peut vendre n'importe quoi sur son seul nom.	0
934	Une belle fresque historique , qui retrace le parcours d'un homme a travers l'asie en pleine tourmente et sous le coup des guerres et des revolutions dans les années 20 , l'auteur decrit avec beaucoup de precision les paysages ,les ethnies et les mythes de ces regions d'asie centrale.	1
5447	"Cet album constitue le troisième d'une trilogie composée de ""Dogs and butterfly"",""Littlequeen"" (le meilleur) et celui-ci."	1
4632	Bon il nous refait le coup du chanteur énervé qui radote et qui dit parfois n'importe quoi , le tout avec son supplément de femme mais on l'aime bien car son talent lui fait rarement défaut; pour les inconditionnels.	0
1865	"Le roman fondateur de l'héroïc-fantasy!!! Grandiose, un chef d'oeuvre!
 Epique, intense et dépaysant."	1
664	A lire les commentaires, le livre déchaine quelques passions. Ce qui est une bonne chose pour un pamphlet.	1
2679	Bon film émouvant, pour les amateurs de Zhang Yimou (ici intimiste et plein de retenu avec toujours une dose d'humour et de détachement) et ceux de Takakura Ken, dans un rôle classique pour lui de japonais peu disert et faussement impassible car plein de sentiments et de ténacité (paternelle ici).	1
2154	Je ne peux pas m'empêcher de mettre cette note là. Pourtant, j'ai lu les livres, et les ai appréciés.	0
3763	Fan des livres de Michael Crichton, j'avais terminé Soleil Levant quelques semaines auparavant ; C'est avec curiosité que j'ai acheté le DVD, et bien j'ai été très déçu : l'adaptation à l'écran est à la limite de l'incompréhensible, je suis sûr que la plupart des spectateurs n'ayant pas lu le livre n'ont pas compris certains passages (par exemple, le centre de recherche sous la patinoire ?) ; De meme, le cheminement de l'enquete n'est pas très clair, on ne sait pas très bien où vont les 2 flics et pourquoi .	0
5200	Si l'Acis et Galathée de Haendel n'est pas comparable à celui de Lully, il faut reconnaître que sous la direction de W.	1
5901	Disque fait à la va vite et le problème c'est que ça s'entend ! Les compos sont très moyennes, le son est crade et le tout très sombre voir glauque.	0
