	sentence	label
5743	On retrouve dans cet album des titres non diffusés sur nos ondes  et qui sont de qualité : je veux parler de titres tels que Rushing, The sky is broken ou My weakness, qui semblent nous attirer vers un monde plus paisible ou Everloving, un titre où la coordination des instruments en présence est simplement merveilleuse.	1
107	ALiena n'est pas une suite des piliers de la terre mais un de ses chapitres.	0
4353	j ai decouvert cet album en decembre 2006 , grace au livre de Philippe Robert que je remercie au passage .	1
2092	Voilà un film d'action fort réussi.	1
4071	J'ai découvert Mika - comme beaucoup de personnes? - via le Grand Journal, et j'ai adoré dès les premières notes.	1
4760	Le dernier travail de Bernard Herrmann est aussi impressionant qu'un scenario de Paul Shrader et Martin scorcese.	1
762	Patricia Cornwell m'a beaucoup déçu avec ce livre.	0
1995	Des textes , aux photos, tout dans ce livre est admirablement mis en valeur.	1
1059	Je recommanderai ce livre meme à une personne qui n'aime pas la science fiction tant la force de l'intrigue est grande.	1
3430	J'ai acheté ce DVD en me disant que j'allais retrouver quelques émotions.	0
5443	Ce disque est bien la preuve qu'il ne suffit pas d'être un excellent interprète pour faire un bon album.	0
1491	ce livre est un vrai torchont ! Il n'y a que des critiques (la plupart du temps pas fondés) et sans aucune intelligence.	0
705	J'ai lu ce livre il y a longtemps deja mais il m'a fort marquée, du point de vue mythologique (sammain, et les renseignements apportés sur les traditions m'intéressaient beaucoup) mais aussi ce livre est assez sanglant.	1
5409	Je suis un fan de Mylene Farmer et j'ai acheté le dvd avec curiosite'.	0
4408	Si vous n'avez que très peu goûté à Led Zep alors cet album peut être un très bon angle d'approche.	1
4540	Cet album est superbe autant que méconnu. Il est à part dans la discographie du groupe.	1
1675	Le livre de Meyssan aurait pu être sérieux s'il avait été limité au doute très plausible que l'auteur suscite quant aux causes de la destruction d'une partie du Pentagon.	0
3072	Jeunet s'attaque au film historique et il s'y prend mal.	0
2660	"Quand on évoque les Tontons, on pense immédiatemment à la scène de la cuissine, aux ""bourre-pif"" que se prend Blier, au ""gugusse de Montauban""."	1
3635	"Réaliser une excellente suite au superbe ""Le Masque de Zorro"" n'était pas chose aisée."	1
219	"Ce serait indispensable de SPECIFIER que  :
 il s'agit de livre pour enfants, cela m'aurait bien rendu service, car je ne sais pas quoi en faire e ces deux livres, car honnêtement quel enfant a envie de ces livres avec de telles recettes aussi élaborées ????"	0
2293	Beaucoup de poésie. Une belle interprétation.	0
2909	Ce film raconte le difficile retour à la vie civile d'une femme après une peine de 15 ans de prison.	0
449	"Bien que le style d'écriture soit beau, ""L'étrange histoire de Benjamin Button"" m'a laissé un peu sur ma faim car ce n'est, après tout, qu'une nouvelle et que 50 pages pour raconter la vie d'un homme, c'est très très court."	0
3981	si vous etes fan de la trilogie , passez votre chemin, c'est bourré d'effets spéciaux , mais l'histoire est plate.	0
1610	"Attention, la ""Méthode Silva de contrôle mental"" est un ensemble sectaire répertorié par la commission d'enquête parlementaire sur les sectes."	0
2494	Je l'ai vu au cinéma, c'est un superbe film.	1
5713	Attendre 8 années pour un tel résultat.	0
1011	Le livre de Thoreau est un chef-d'oeuvre, bien sûr.	0
5395	"Incroyable! Je viens de découvrir tristania et cet album ""world of glass""."	1
1410	Je n'avais jamais rien lu de F.S. Fitzgerald avant Gatsby.	1
5964	Il ne faut pas se leurrer.	0
2524	Selon moi Pocahontas fait partie des plus mauvais disney, du point vue histoire malgré quelques rares bonnes scenes il reste trop mauvais .	0
5943	C'est la plus grosse erreur marketing de Jarre!!Je mets une étoile pour être sympa, mais c'est une véritable déception! Je ne l'ai écouté qu'une seule fois.	0
3562	Bonjour Madame, bonjour Monsieur,  J' ai regardé Marie Octobre pour la onzième fois hier soir, je crois bien que cela m' a plu encore davantage que la fois précédente.	1
4538	"Rubber soul est un album fantastique, qui comme la si bien un internaute ci dessus, a fait passé les beatles de ""l'excellent"" au ""mythique"", grace a des perles pop, des nouveautés."	1
3599	au bout d'un moment on comprend que c'est en fait un film de promotion - déguisé en histoire du lieu sous les empereurs - du musée de l'ermitage avec tous les défauts du film instrumental de ce genre: clichés un peu lourds d'autant que c'est lent, cours assez creux d'histoire de l'art sur quelques pièces de collection, défilés de personnages convenus en costumes, de différentes époques ( ça fait si versailles m'était conté, en moins enlevé).	0
3323	Effectivement, un régal pour les passionnés de la série BD mais il est clair que ça ne peut pas plaire à tout le monde parce qu'il n'y a peut-être pas la dose d'amour souhaitée, le rythme voulu ou un dialogue idiot sans acteurs valables; ces gens-là ne savent pas apprécier un bon film à sa juste valeur.	1
435	Ce recueil de nouvelles est indispensable pour les fans de Dan Simmons.	1
96	Il s'agit ici de la plus belle histoire d'amour de tous les temps.	1
901	"Voici le roman sur lequel Claude Chabrol s'est basé pour réaliser le film ""La Cérémonie""."	1
279	Attention, ce n'est pas un Douglas Kennedy!  Et oui, ce livre est très décevant.	0
5215	Je dessine sur les nappes des restaurants, sur des bouts de papier (oui, je sais, j'ai une vie passionnante ^^), et mes neveux sont toujours éblouis par mes dessins.	0
5393	"J'étais motivé quand j'ai écouté les premiers sons mais au bout de quelque minutes je me suis dit ""Tiens ca me rappelle quelque chose ça !"", ""et ça aussi"" et ça c'est ."	0
5512	Cedar Walton est un excellent pianiste hard-bop, cet album de 1967 en est la preuve.	1
5092	J'ai toujours bien aimé Whitesnake,la voix de Coverdale,les compositions oscillant entre heavy blues et Hard rock;quelques morceaux rappelant meme le grand Led Zep.	0
209	C'est un livre qui mérite sa place de part le fait qu'il apporte une autre vision, certes sarcastique mais non moins réelle, du milieu médical et de l'ego surdimensionné de certains de ses agrégés de médecine médiatiques qui recherchent malheureusement en premier lieu plus leur gloire personnelle que défendre une cause juste.	1
714	Les Trois quarts des ingrédients nécessaires aux recettes sont rares donc coûteux.	0
1033	très belle histoire que celle de cet enfant qui se bat contre la leucémie, c'est triste mais si beau, on est captivé.	1
5366	"Les début de lush sont plus ethérés (plus 4AD, le label), participant à la vague ""Noisy"" de ce moment, les trois premiers maxis sont épuisés aujourd'hui et cette édition américaine permet de les re-découvrir."	1
3998	UN DVD très decevant.	0
4464	"L'enregistrement est excellent, le seul bemol est le honteux ""Dulcissima"" de Janowitz, chanteuse qui j'adore, mais c'est vraiment, mais vraiment beaucoup trop haut pour elle, et du coup très raide; à titre de comparaison, écoutez la fluidité et souplesse de June Anderson (Levine/DG)..."	1
3283	The president has been cloned. It is up to Dick Dix (plural) to rescue him from an alien plot.	0
3247	J'ai la version zone 1 de ce film et si la zone 2 est la même, c'est un superbe objet à un prix très abordable.	1
4003	j'ai écouté ce disque par curiosité. c'est bien fait, belle voix, beaux arrangements,belle production.	0
4767	Lorie vise large, cherchant aussi bien l'appui des petites filles dans ses bluettes, des pré-ado dans son look (et son niveau de réflexion.	0
3813	J'ai juste adoré et surtout redécouvert un groupe qui marqué de ses riffs l'histoire du Heavy Metal.	1
1671	France Culture et Alexandre Adler étaient pour moi des références.	0
5309	Ce disque est plein de charme. La rencontre de ces deux artistes met en évidence leur richesse personnelle.	1
4527	Sonnez cornemuses et autres oliphants AC/DC débarquent et va tout bousculer!  Les frères Young n'ont que faire de toutes explications philosophiques, théologiques ou sociologiques, ils sont nés pour le rock et le rock est eux.	1
828	WOW!!! Harry Potter est une drogue, pour moi.	1
2604	Fan absolu des 2 premiers, j'ai été plus que déçu par ce film.	0
5513	Que du bon.	1
1710	Passez votre chemin! AUcun interet pour ce livre qu'on a hate de finir mais dont on ne voit pas le bout.	0
1622	"J'avais déjà été déçue par ""Dossier Benton""."	0
5319	Albert Cummings est né en 1968 aux U.S.	1
3204	Fantastique.tel est le superlatif qui colle le mieux a ce qui est la meilleur comedie de l'annee.	1
920	Du bonheur à chaque page ; un réel plaisir gustatif, des saveurs inédites mélées à d'autres plus traditionnelles, et pas besoin d'être un grand cuisinier pour épater tout le monde ; un indispensable	1
3415	Voilà un témoignage de la dernière tournée d'Alain Bashung 10ans après le fameux « Confessions Publiques ».	1
3881	Le film parle d'un couple qui a des difficultés avec leurs relations.	0
2778	Un scénario de cette trempe est chose rare à Hollywood, et même dans le ciné indépendant US.	1
4434	Supergrass: le groupe de power pop par excellence.	1
3376	Pas de problème: produit en parfait état et en très bon rapport qualité prix. Transaction rapide à recommander!	1
5193	Cela fait maintenant des décennies que l'industrie du disque a vendu son âme au diable des distributions internationales où tout le monde chante n'importe quoi pourvu que des noms ronflants fleurissent sur les pochettes.	1
4600	"Mais quelle déception, ce ""Sacred Heart""! OK, Dio est un des plus grands chanteurs de Hard Rock au monde, ""Holy Diver"" et ""The Last in Line"" (ses 2 premiers efforts en solo) sont de véritables classiques du genre, mais ce troisième essai s'avère bien faiblard."	0
1613	j'ai été déçue par ce livre, je m'attendais à un suspens haletant, une intrigue noire mais captivante, je suis restée sur ma faim.	0
1251	C'est le second livre de cet auteur que je lis, et j'ai encore ce même questionnement, ce livre vole-t-il trop haut pour moi ??  toutefois, le thème était passionnant, même si parfois, on se perd dans un jargon inconnu des profanes que nous sommes.	1
2187	Derrière un titre accrocheur et une Jaquette laissant penser qu'il s'agit d'un Thriller se cache un film ennuyeux qui traîne en longueur pour arriver à finalement nous faire réaliser - trop tard - qu'on perds notre temps et qu'il n'y a rien à voir.	0
3956	Tout symplement exellent,génial et fou rires assuré tout au long du DVD?on ne s'en lasse pas!!	1
4476	"Album réalisé à l'occasion de la 1ere reformation du goupe et d'une tournée ""alimentaire"" au Japon (la destination à la mode de l'époque), celui-ci démontre clairement que la magie a disparu."	0
3926	Orson Welles nous livre une version d'Othello, sobre mais efficace, le personnage d'Othello est sombre et déterminé, Iago est un traître magnifiquement interprété, un grand classique réalisé par un des meilleurs réalisateurs du 20 ème siècle, à ne pas manquer.	1
1915	Livre sympa quand on ne peut pas lire au calme, au café, dans le métro ou mieux : à la plage quand il faut surveiller les enfants .	0
933	L'une des critiques qui a été faite à Walter Benn Michaels est que ses arguments, s'ils collent avec la situation américaine, seraient moins pertinents en ce qui concerne la politique française.	1
873	Vivre pleinement sa nature humaine, voici un merveilleux exemple de vie d'acceptation totale de soi, de toutes les émotions difficiles et heureuses de la vie, si certains passages semblent parfois un peu longs, ils en accord parfait avec les autres plus rapides et joyeux, c'est la pleine acceptation des rythmes, changements, l'initiation parfaite au bohneur de vivre.	1
2448	"""ennui garanti"" est vraiment l'une des expressions les moins compatible à cette magnifique série elle est à la drole (jack O'Neill et ses blagues) et elle est aussi très intelligente."	1
1621	et pas comme nous avons souvent tendance de craindre qu'elle soit.	1
5042	C'est album est une tuerie de bout en bout !! Jamais une musique ne m'aura autant donné la peche que celle d'Andrew !! PARTY HARD !!!	1
4089	Si MJ ne voulait pas de cet album (il aurait préféré ne sortir que les chansons inédites), sa maison de disques a eu bien tort d'insister.	0
5753	Troisième opus des Mancuniens et pour la première fois des visages clairement affichés(quoique plutôt anamorphosés),histoire de répondre à leurs détracteurs qui leur reprochaient une franche austérité.	1
2805	Starship Troopers, premier du nom, est l'un des fleurons du cinéma fantastique.	0
1700	Le ton est monotone, l'histoire de fond assez plate, les personnages un peu trop caricaturaux.	0
229	ce livre est trés sympas mais il faut évidemment s'interesser un minimum à la corée du sud.	1
4553	"L'écoute de l'extrait de la chanson ""help"" que vous proposez fait référence à la version courante de cette chanson."	0
74	c'est le seul mot qui me vient à l'esprit après avoir dévoré le premier tome des aventures de Joséphine.	0
3061	Les acteurs sont formidables. Chéreau dirige à merveille l'une des plus belles panoplies d'acteurs français.	0
192	5 ans après la parution de ce livre, sa lecture démontre à quel point le sémillant Baverez s'est avéré un très mauvais prophète.	0
3410	La qualité de cette deuxième saison n'est pas en cause, elle est excellente, bien qu'un peu trop orienté ado à mon goût; la série mûrira de saison en saison par la suite, tout en gardant la même qualité et en restant fidèle à l'univers créé par Joss Whedon.	0
5588	Je ne puis trouver les mots qualifiants ce cd géant tant la musique et bonne.	1
1371	Ce livre, pour moi, est d'un intérêt tout relatif tant les idées et les opinions des deux protagonistes sont telles que l'on les avait imaginé - bonnes ou mauvaises, ça c'est un autre débat - sans véritable prise de risque ni d'un côté ni de l'autre, sans réel esprit d'ouverture ou de compréhension pour la réalité de « l'autre ».	0
1384	"composé de retours en arrière ,de remise en ordre de la mémoire ce livre présente un intérêt moindre que ses précédent il ne sert qu'à introduire la problématique du suivant Il rappel un peu ceraines émissions TV telles les ""best off"" Bref il fait un peu ""bouche-trou"""	0
3823	Cette émouvante histoire, dernier film tourné par Yves MONTAND, a été quelque peu occultée à sa sortie par la mort de ce très grand acteur et des déballages qui ont fait la UNE de la presse de cette époque.	1
3473	D'une durée totale de 90 minutes, Animatrix est un recueil de 8 courts-métrages animés aux techniques variées et dont le contenu est plus ou moins en rapport avec l'univers de Matrix.	1
5257	Contrairement à quelques autres groupes de Rock, ACDC a toujours réussi à traverser les époques en restant fidèle à ce son si mythique!  Cet album est vraiment grandiose et ACDC est bien de retour !  La plupart des morceaux me donnent la chair de poule, plutôt rare ces derniers temps.	1
433	Ce livre est une source importante d'informations sur cette tournée des Stones(manager,tourneur,groupie.).	0
1903	J'ai voulu faire comme les moutons de panurge , suivre le troupeau mais je choie sur un roman d'une banalité affligeante !!  Intrigue décousue ; une histoire qui change du tout au tout sans aucune cohérence ; intérêt limité pour les personnages , si ce n'est peut être pour Lisbeth Salinger et Henrik Vanger plus profond que le personnage principal Mikael Blomkvist qui est aussi charismatique qu'une serpillière.	0
4369	je suis déçue de ce produit il n'y qu'un seul titre qui me satisfait, je pensais que c'étai un best of avec les meilleurs morceaux	0
761	Quelle déception. Je m'attendais à une Kay Scarpetta qui a repris le dessus et repart en pleine forme.	0
798	Les grands adorent le lire aux petits.	1
4879	Tout simplement le meilleur CD que j'ai entendu depuis au moins 5 ans ! Les textes sont enormes, melange de realisme et d'humour.	1
3274	"au début on se dit: ""bon c'est mal barré mais tellement de gens ont aimés que ça doit valoir le coup d'oeil."	0
342	"Il en aura fallu des petits livres comme celui-ci, des unes du ""Point"" sur ""La France assistée"", des reportages sur ""l'insécurité galopante"" ou sur les ""grévistes preneurs d'otages"" (sic !) pour qu'un soir de Mai 2007, le peuple français, pourtant réputé frondeur et turbulent, ne se décide enfin à goûter aux joies de la soumission à ses maîtres ""démocratiquement élus"" et drapés dans leur ""légitimité des urnes""."	0
5848	metallica annonce un retour au metal rentre-dedans-celui qui lui a donné ses lettres de noblesse-mais se fourvoie dans une repompe neo metal au moment où ce genre marque le pas!  metallica, qui a parfois innové mais surtout sorti des compos intemporelles au point d'être le chef de file du mouvement metal au sens generique du terme, est avec st anger, à la traîne.	0
5338	Nous connaissions Sandrine actrice moyenne de films moyens, nous la retrouvons une fois de plus chanteuse affligeante ; elle l'avoue elle-même en faisant constamment référence à 2 autres désastres de la chanson (sic!)Carla et Vanessa.	0
5701	Un jolie mélange ou les chansons rythmer ce croise avec des balades a pleurer.	0
1497	"Le titre est mal choisi, j'aurais plutôt vu ""Une bobo à Hollywood""."	0
5694	Eh oui, Tarja n'étant plus là, certains réchignent le nouveau cru de NW.	0
3980	Fervent admirateur de la trilogie je dois avouer avec depit que Lucas a oublié de penser à un  scénario entretemps.	0
324	Excellent moment de lecture, à la fois reposant et enrichissant.	1
2760	"Je n'ai pas de commentaire à faire sur ce DVD car il a été impossible de le visionner:  1- On me reclamait code régional + message ""error""."	0
4287	Une rave qui arrive à point nommé, pour l'été, j'appelle vraiment pas ça de l'électro à proprement parlé mais une dance réchauffée 40 fois qui s'inscrit de toute façon dans le même rang que les Fuck Me I'm Famous.	0
3273	La première fois que j'ai vu ce film, c'était dans une salle de cinéma.	1
5816	un bon achat! mention spéciale pour Burst Générator, un morceau booster dont je ne me lasse pas.	1
2108	D'accord, techniquement, ce film a plutôt vieilli : l'incrustation d'Elliott le dragon peut faire sourire la jeune génération habituée aux images de synthèse.	1
2000	Prison Break, c'est un peu l'histoire d'un pétard mouillé ; ou comment , à partir d'une idée originale et complètement improbable faire une série construite autour de l'évasion de deux frères.	0
5669	Pascal Dusapin est né le 29 mai 1955 à Nancy.	1
1378	et comment dire.	1
4168	Une pure merveille éveil des sens volupté, naïveté, .	1
1626	Fidèle lectrice des aventures de Dortmunter, je suis un peu déçue par ce livre, dont je trouve l'intrigue assez molle et où je ne retrouve pas l'humour décalé des autres livres.	0
3301	Ce film semble essentiellement dédié à la beauté sculpturale de Monica.	0
4133	C'est vrai, aprés un chef d'oeuvre comme Ziggy Stardust, c'était dur de faire aussi bien.	1
4364	"programme alléchant, gros renfort de presse ""spécialisée et non"" (de toutes façons ce sont les mêmes qui écrivent dans les deux."	0
4181	"C'est à cause de la prolifération industrielle de ce genre de productions appelées ""Arèneubi"", très éloignées du  , de la  , du   mais aussi du   et de l'  qu'on en arrive à ce que 51% d'un panel de téléspectateurs (de TF1 d'accord, mais quand même !) pensent que ""R&amp;B"" est l'abréviation de ""Rap &amp; Blues"" (oui, vous avez bien lu)."	0
2335	j'ai bcp aimé, ce film est plein d'émotions et il est bon aujourd'hui de se plonger dans un phénomène d'actualité touchant la santé avec une pointe d'amour.	1
3459	C'est un film qu'il faut au moins voir une fois dans sa vie.	1
4830	La liberté de création pour un groupe c'est de pouvoir être prétentieux et pompeux après avoir été lumineux et audacieux.	0
986	J'ai acheté ce livre pour mon fils quand il avait 3 ans et je dois dire que j'ai trouvé la fin tellement horrible que je l'ai caché dans un tiroir.	0
969	C'est un très bon roman, mais toute personne qui connait un tant soit peu la nature, les animaux sauvages et les loups ne pourra croire un instant que ce soit une histoire vraie !   Les gens d'aujourd'hui sont essentiellement des citadins et leur connaissance des animaux se limite aux histoires de Disney.	0
3397	Une bonne idée, un bon sujet mais un traitement à charge = les naturistes sont des nudistes qui sont obsédés sexuels ou illuminés ! Bref un film à charge par un réalisateur qui ne maîtrise ni son histoire ni son contexte.	0
222	Dans ce roman on entre dans l'univers très fermé d'un groupe d'étudiants intellectuels américains liés entre entre eux par un pesant secret.	1
5414	Je voudrais simplement dire que, pour moi, c'est le meilleur album de Faith Hill. A écouter d'urgence !	1
2474	"""sous-titre : comment se foutre de la gueule de l'amateur du ciné d'horreur"" : en lui fourguant ce qu'on a digéré pendant des années en pensant que ce crétin va nous croire sincères."	0
3519	Sortie presque en même temps que le Mission To Mars de Brian De Palma, on lui préférera sans nul doute celui-ci..	0
4404	Ouf, je ressors de la 3eme ecoute de cet album.La musique commence a s'impreigner.	1
5883	"Je viens juste de commander l'album et ne l'ai pas encore ecoute, mais je connais un titre dessus qui est ""help me get the feeling"" interprete par King Curtis et Ray Sharpe."	1
3665	Je crois que c'est l'un des plus gros navet que je n'ai jamais vu.	0
500	Au vu des nombreux prix, parmi les plus prestigieux pour le genre, qu'il a récolté et de son excellente réputation, j'avais une très grande envie de lire ce roman.	1
2104	La première saison est exceptionnelle !  On s'attache rapidement aux personnages.	1
3187	Lamentable. Ayant beaucoup aime Ma femme est une actrice je me suis precipitee sur ce DVD. Deception.	0
5723	C'est une honte que ce petit bijou ne soit pas sorti en zone 2.	1
716	clair, ordonné, cet ouvrage référence un très grand nombre de pierres, avec de précieuses informations	1
126	Ce livre résume avec rigueur et clareté les fondements philosophiques du nihilisme.	1
4228	Après un premier album déjà très convaincant (un peu plus sombre, plus faisant ambiance de film), voici le deuxième opus.	1
5540	Une véritable tuerie qu'est cet album et qui s'inscrit comme leur meilleur album avec Generator.	1
2210	Voici un exemple de ce que le cinéma américain peut aujourd'hui produire de mauvais. C'est pesant, vide d'intérêt.	0
4872	Attention, arrêtez tout, laissez cramer le steak, déborder le bain, brailler la marmaille, sonner le facteur (pas d'inquiétude, il re sonnera.	1
5057	Le meilleur de Cannibal Corpse incontestablement! L'album qui fait prendre un tournant plus technique dans la carrière du groupe de death le plus culte et le plus méritant qui existe.	1
5842	Avec ce nouvel opus, Muriel Moreno nous apporte sa vision indispensable de la musique électronique en brassant tous les genres, et en créant un univers mélancolique, joyeux, oubliant la parole pour se consacrer davantage à l'émotivité de sa musique.	1
1406	Difficile d'être plus complaisant avec soi même que Soral dans cet ouvrage.	0
2288	Les acteurs jouent à la perfection, ce qui donne une justesse déconcertante au fur et à mesure que nous avançons dans l'histoire.	1
765	Très bon livre, à recommander, une petite remarque, j'aurais aimé plus d'exemples de menus pour savoir si les associations de plats que je choisi sont équilibrées d'un point de vue alimentaire.	1
1468	Déçue par ce livre qui devait nous dévoiler la clé pour entrer en contact avec des personnes décédées.	0
4351	pas de disque plus surévalué que celui-ci,,,,, pour moi c'est de la musique d'ascenseur et encore à condition de ne pas monter dans une tour trop haute sinon on risque la gerbe ! Veuillez, je vous prie, écouter plutôt le grand Petrucciani ou Joachim Kühn ou Mc Coy Tiner ou.	0
3832	Quand je repense à la première trilogie de Star Wars, ce qui me vient immédiatement à l'esprit ce sont les personnages plein d'humour, les batailles spectaculaires et l'histoire simple mais efficace : un vrai spectacle.	0
400	C'est le deuxième roman de Connelly que je tente de lire, et même si l'envie de savoir qui était cette Lilly me titillait, je n'ai pas dépasser les trente pages.	0
1168	"je suis déçus, l'idée avait l'air interessante au départ, mais cette histoire n'amène rien de plus aux héros des merle ""fortune de france"" époque I, avoir repris de faire s'exprimé le personnage dans le parler de l'époque comme l'avait fait en son temps mr merle père, pourquoi pas! En ce cas, il eut fallu être d'une rigueur absolue, et l'histoire retracée par notre ami miroul n'apporte rien de plus que nous ne savions déjà."	0
2296	Un nouveau Bond, un nouveau souffle : CASINO ROYAL a non seulement été prometteur, mais plus encore il a offert un nouveau départ à la franchise Bond.	0
2965	Une série très manipulatrice qui fait intervenir des exégètes célèbres et des autorités des milieux chrétiens sur des points de détail, et donne la parole pour les grandes conclusions à des intervenants dont l'objectif est de discréditer les Evangiles.	0
