	sentence	label
4543	Portishead revient avec un deuxième album, trois ans après Dummy, mais avec un style bien qu'un peu plus colèrique, toujours aussi bouleversant.	1
3420	J'etais tres curieux de voir ce qu'a fait robert wilson avec les textes geniaux de la fontaine.	0
4014	j'ai écouté ce disque par curiosité. c'est bien fait, belle voix, beaux arrangements,belle production.	0
4701	"Cette album je le définit en 1 mot ""mauvais""mais alors vraiment mauvais."	0
1743	Cet été, j'ai revu un ami que je n'avais pas vu depuis mon mariage il y a 3 ans !! A l'époque il fumait pas mal, presque 1 paquet par jour, et là j'ai remarqué qu'il ne fumait plus même pas une avec l'apéro !!!.	1
2419	Le fabuleux cynisme housien prévalant en saison 1 laisse place à trop de bons sentiments.	1
2096	Vraiment pas de quoi récolter des palmes outre-atlantique, pas de quoi hurler au génie d'interprétation, pas de quoi se pavaner devant ce scénario inconsistant !! Mais après tout si ce film a permis à certaines dignités haut-placées de revisiter leur manuels d'histoire et de reconnaître le sacrifice patriotique sincère de tous ces oubliés, alors il a rempli son rôle.	0
5987	"Le première suite ""crossover music"" de Claude Bolling. Elle date de 1975 mais elle n'a pas pris une ride."	1
1726	je constate avec soulagement que je ne suis pas la seule a trouver ce roman terriblement decousu, ennuyeux et narcissique.	0
2431	On ne le voit jamais sur les écrans et j'étais impatient de le voir depuis fort longtemps.	0
2914	"très attendue,cette enième aventure de jason bourne est pourtant une déception,les scènes des précédents semblent compilées, rien de nouveau dans l'intrigue et surtout une réalisation façon clip avec des plans qui changent toutes les demi secondes, c est fatiguant, visuellement, même les plans fixes avec dalogues tremblent !
 dommage"	0
3122	A chaque génération, il y a une élue, elle est la tueuse, elle est l'unique ! Pour notre génération, Buffy est incontestablement LA SERIE, L'UNIQUE, LA MYTHIQUE, L'ELUE de nos coeurs.	1
5100	Cet album, c'est la décéption.	0
4775	Album après album GOJIRA cofirme tous les éspoirs placés en eux. Bientôt une référence internationale incontournable.	1
3561	J'ai attendu beaucoup de ce film, car avec Delon et Deneuve on croit que ce sera un classique.	0
2727	miyazaki c'est encore surpassé aprés porco rosso et mon voisin totoro voila ce chef d'oeuvre je vous conseil de l'acheter avant qu'il soient indisponible a la vente comme les precedant film d'animation de miyazaki	1
5788	Showbiz m'avait enchanté. Je me disais, un peu opportuniste, mais soyons honnête, y'avait du talent et de belles chansons.	0
456	Immense fan des Bidochon et des collections de Binet ( Kador, Mr le ministre.	0
3704	Aussi incroyable q'un livre,le film Le Seigneur des anneaux vous eblouira par sa qualite d'image et son aventure envoutante.	1
1131	Certes des manuscrits mémorables et inédits, mais la lecture de cet ouvrage est vraiment fastidieuse.	0
5182	J'ai découvert cet album cet été et chaque jour je lui découvre de nouveaux talents.	1
3547	Evidemment, se retrouver en face de Cindy Crawford, ça peut donner des complexes? ou au contraire une super motivation pour, enfin, tenir ses bonnes résolutions et s'y mettre pour de bon.	1
1550	C'est un bon ouvrage: il est concis, les idées sont clairement exposées, et, par chance, elles sont intéressantes.	1
443	25 décembre, j'attends la famille, je vous dfis vite ce que m'a inspiré ce livre.	1
437	En réalité, je lui aurais mis 4.	1
4605	Attention si vous écoutez cet album, c'est mieux avec un volume bas et non moyen ou a fond car ça déchire les tympans.	0
2790	Ce film n'est pas simplement un pauvre navet c'est surtout une escroquerie morale de plus puisque on a essayé de faire passer pour Vraie une histoire énorme ou tout est faux .	0
872	Je suis très déçue par ce livre, on m'en avait dit tellement du bien, et moi, franchement, je n'ai pas aimé du tout.	0
3656	Voilà une bien étrange fleur, dans un film d'aventure et plein d'humour avec ça ! Une belle soirée en perspective.	1
5900	Cet album est une pure merveille!  Ballades mélodiques extraordinaires, accompagnements de génie et une touche de blues mélancolique pour parfaire cet album que je conseille à tout ceux qui ne l'ont pas écouté et je vous assure que vous allez l'apprécier!	1
3607	"très content du produit
 délai de livraison respecter
 merci"	1
1716	Je suis passionné d'Histoire, et de l'histoire de la 2nde Guerre Mondiale en particulier.	0
3850	Malgré le renom du réalisateur, il est difficile d'adhérer à une oeuvre où fleurissent vulgarité , scatologie et violence-gore dont on perçoit mal l'objectif (peut-être simplement un but de provocation - gratuite ? )	0
879	Cet ensemble de nouvelles est assez éclectique. Certaines valent vraiment le coup, d'autres moins.	1
4999	"A part ""Under pressure"" avec Bowie, le reste est à jeter."	0
4420	"personnellement, j'ais découvert Pearl Jam avec cet album et j'ais tout de suite adoré l'ambiance de celui-ci et tout ces titres, je conseillerai donc vivement d'acheter cet album (contrairement aux propos de PearlJamFan qui n'en est pas un vrai!) à la place de Yield qui ne mérite pas ça réputation et qui ma déçu (par ex avec ""do the évolution"" qui est plus mou qu'en live oû il claque si j'puis dire."	1
275	Ce livre donne l'impression de ne pas avoir été terminé.	0
4289	"S'il ya une chose de vraie, c'est que ce cd respecte son titre "" Désobeissance civile."	1
3698	Ah! combien de mercredi après-midi ai-je passé devant mon poste afin de savoir ce qui allait encore arriver à ces CHEVALIERS DU ZODIAQUE.	0
4237	J'adore cet album ! Encore une fois Yannick Noah a su s'entourer d'excellents auteurs-compositeurs et il chante vraiment avec tout son coeur et tout son corps (je l'ai vu sur scène !).	1
5381	je trouve lorie genial c'est terrible elle est hyper dynamique tout ce qu'il faut j'aimerais faire comme elle plus tard	1
957	Books like this are temptations, to give up reading and devote life to rereading.	1
4309	limp bizkit est au metal ce que britney spears est a la musique!!! C'est a dire honteux et commercial!!! Cet album surf sur une mode lancee par korn et n'ajoute rien au genre!!! Les musiciens n'ont aucun talent , surtout wes borland (guitare) qui n'a aucun son et plagie la plupart de ses riffs (ex: nookie sur les red hots) ! Bref si vous voulez un vrai disque hip hop metal allez voir du cote de biohazard ou de body count	0
2786	Kagemusha signale le retour de Kurosawa au drame historique. L’action se déroule au Japon durant le seizième siècle.	1
763	Voilà le roman typique du bon élève : studieux, attentif et.	0
1563	Je suis un fan absolu de Dune qui a bouleversé ma vie de lecteur.	0
1801	Qu'est-ce que j'ai pu m'ennuyer en lisant ce livre ! Je n'ai pas du tout accroché.	0
5896	radiohead est sans doute l'un des groupes les plus impressionnant de ces dernieres annees.	0
4130	Encore pire que le précédent opus de ce tribute band.	0
776	Hitler, comment a-t-il pu etre un homme presque normal en privé et d'autre part ce monstre que l'on connait? très étonnant???? Rochus Misch, A-t-il jamais rien vu ou jamais rien entendu ou il ne voulait rien savoir.	1
3069	Crash est beaucoup plus qu'un simple film, c'est un flirt avec la mort, une approche différente de l'attirence sexuelle pour des objets que la plupart des gens trouvent banals.	1
4090	Je ne suis pas contre la musique de Michael Jackson, ni contre sa personne, mais Thriller est un disque d'une qualité variable.	0
4018	Je viens juste de lire les commentaires et apparmmenrt soit on aime soit on desteste .	1
1396	Cet ouvrage s'adresse aussi bien à ceux qui, comme moi, ont vécu la guerre froide à travers des moments de très grande tension comme la crise des missiles de Cuba, le mur de Berlin, l'écrasement de la révolte tchécoslovaque, la guerre du Viet-Nam ou la crise des Pershing II qu'à ceux qui n'ont connu de ce conflit que la Perestroïka de Gorbatchev, la Guerre des Etoiles de Reagan et l'effondrement de l'Empire Soviétique matérialisé par la réunification allemande.	1
3189	"""les sopranos"" est indeniablement une des meilleures sinon ""la"" meilleure série des ces quinzes dernières années!!! Les scénarios sont tout simplement géniaux, la mise en scène impecable et les acteurs donne de la dimension à leurs personnages."	1
5559	Vulcain est un groupe de Hard Rock français fondé en 1981 et qui a stoppé sa carrière en 1998, après 1 démo, 7 album studio, 1 E.	1
1514	Cet album, c'est d'abord un regard, celui que nous portons sur les autres.	1
902	Les parents de Momoko veulent le meilleur lycée pour leur fils. Momoko, elle, ira dans le lycée du coin.	1
3700	Je vais etre franc, je ne l'ai pas acheté, on me l'a prété, heureusement!!! De suite on est saisi par l'absence de J Lo par sa voix.	0
3025	Les épisodes se regardent agréablement, il y a un certain intérêt dans les activités de ce commissariat, un certain suspens (mais pas vraiment prenant), quelques personnages intéressants.	0
2312	LES DVD 5 ET 6 SONT MANQUANTS. PAR CONTRE LES 7 ET HUIT SONT EN DOUBLE.	0
3957	Le sujet était intéressant, mais il ne faut pas rire avec ce genre de sujet et éviter au maximum les anachronismes, les erreurs de reconstitution.	0
1886	malgré un bon suspens en début de lecture, ce dernier opus des aventures de Gloria la mathématicienne est assez décevant.	0
5636	Si j'avais écrit « un peu trop best of », cela pour autant n'aurait pas été un reproche.	1
5504	Après nous avoir habitué à des hits r&amp;b et avoir participé à de nombreux featuring (tjs r&amp;b), ce qui lui a fait perdre de sa crédibilité, Ja revient à ses sources.	0
425	Ce livre est beau.	1
1479	Christine es certainement le roman de King le moins abouti.	0
5974	"Avec ""Fragments"", Loudblast nous avait prouvé qu'il savait évoluer vers une musique plus accessible, moins Death mais surtout plus intéressante."	0
4524	Quelle horreur cet album! A l'époque et maintenant,il y a mieux à écouter, les Beatles par exemple.	0
2632	Pour moi, l'un des plus beaux films d'amour, Zoe FELIX et Marc LAVOINE sont taillés pour ce rôle.	1
2936	Fan de la série que j'ai du voir en entier près d'une dizaine de fois, je connais aussi par coeur ce film que je posséde en DVD.	0
5090	Je crois que je suis l'un des rares fan des Who à ne pas vévéré cet album ! En effet je trouve déjà le concept de ce disque boiteux.	0
1055	Allo Huston,  Huston, un agent ancien Fear Agent, se voit envoyé dans le passé suite a un sabotage de sont vaisseau, et doit faire face la création des robots qui ont ensuite bien des centaines d'années plus tard envahi et détruit la majeur partie de la population terrienne.	1
5592	Ce petit chef-d'oeuvre sorti en 1995, marque le retour d'un des meilleurs songwriters de l'americana,après une période agitée pour notre homme, dope et incarcération!cet opus acoustique s'avère indispensable.	1
5973	"Depuis la fin des années 60 avec le fameux ""With a little help from my friends"", Joe Cocker s'est fait le spécialiste des reprises avec une indéniable capacité à s'approprier ces chansons et à les transcender grâce à une voix (un rauque) unique."	0
4733	Où est la différence entre ce disque et un disque de Louise Attaque ? En fait, comme Louise Attaque n’a eu qu’une chanson, ce n’est peut être pas étonnant qu’ils aient fait exactement la même chanson encore.	0
4043	Akon si dit être héritier de Michael Jackson alors qu'il ne sait pas chanter juste, il ne sait pas écrire, il ne sait pas composer, il ne sait même pas danser .	0
4689	Je viens de decouvrir ce cd par les extraits ci dessus.	0
2388	Edition collector en boîtier métal du chef d'oeuvre du cinéaste STEVEN SPIELBERG.	1
4751	Je trouve cet album franchement mauvais.	0
2270	Disney s'est lancé depuis quelques temps dans l'animation 3D en dehors du circuit PIXAR avec ses propres studios d'animation internes.	1
527	Livre inutile. Le livre n'est pas pratique du tout.	0
5121	SANTANA REVIENT AVEC CET ALBUM ET ON AURAIT BIEN AIME SOIT QU'IL RESTE OU IL ETAIT SOIT QU'IL NOUS SORTE UN ALBUM DE QUALITE.	0
1762	Ce livre est très décevant. L'auteur fait preuve d'une méconnaissance de la Bible.	0
5687	Retour d'une version considérée comme excellente en son temps mais qui est en réalité décevante.	0
4480	En 1995, Saga paraît oublié.	1
5379	"Ce disque serait l'oeuvre d'un p'tit nouveau, j'aurais dit ""pas mal foutu"" mais venant d'une icône de la chanson Française j'ai envie d'être plus sévère."	0
202	Très bon livre ,pour cette personne qui nous à quitté il n'y a pas si longtemps.	1
5460	le dialogue magnifique de deux maîtres du saxophone l'un au ténor,l'autre à l'alto, épaulés par jimmy rowlles au piano,leroy winnegar à la basse, mel lewis à la batterie.	1
3683	Rien a redire sur le film qui est une reference dans le style.	0
5334	"C'est encore du ""vieux"" que Mylène nous propose.Après un best of, on s'attendait à avoir un nouvel album studio."	0
4779	du pur Indochine !!!  C'est pas l'album du siècle, mais il est très bon, très agréable.	1
1488	"Si je l'avais lu à l'adolescence, cela m'aurais probablement plu.  Il est d'ailleurs publié en collection ""jeunes adultes""."	0
4978	Oui Metallica se remet en question d'un album à l'autre. Oui Metallica est un groupe culte.	0
4030	Le groupe Hype du moment devant lequel tout le monde se prosterne.	0
1460	La réflexion philosophique se trouve prise de vertige par le vide de ce  texte se terminant par une divagation érotico-lyrique au cours de laquelle Michel Serres fait l'amour avec la Terre.	0
5038	En 1983 l'amerique officielle boude Joan Baez qui pourtant triomphe en Europe,illuminant Paris lors d'un gigantesque concert à la Concorde.	1
4483	Cette album et au-dessus de tout ce qui existe. Ces gens sont des extraterrestres.	1
4119	"Je comprends que les ""fans"" du groupe aient été désorientés par ce dernier CD, mais je le trouve vraiment très agréable à écouter, surtout quand on sait dans quelles conditions il a été élaboré."	1
4356	L'immense succès de cet album est totalement justifié.	1
2020	Pleins d'acteurs connus ou à la mode, principe de l'histoire chorale avec des scènes de repas, d'engueulade, Paris, la tour Eiffel, du mal de vivre.	0
875	"Assez décevant: la plupart des expressions choisies sont ""transparentes"" si bien que les commentaires de l'auteur n'apportent pas grand chose de nouveau."	0
975	""" On en sort autrement qu'on y est rentré "" Ce livre, qui porte bien son nom, est d'une simplicité de lecture remarquable et ."	1
4317	Avec les meilleurs musiciens de la planète (Petrucci, Portnoy, Rudess et Levin), ce groupe nous fait le bonheur de nous livrer à chacun de ses albums, des monuments musicaux.	1
5984	Ryuichi Sakamoto, pianiste et compositeur atypique à souhait, a souvent fait voisiner dans son aeuvre traits de génie et fautes de goût.	0
1313	"Voici une oeuvre bien surestimée, essentiellement à cause de l'estampille ""Alan Moore"" mettant en transe les hordes de télérameux qui pullulent."	0
2156	Comme d'habitude WARNER n'a pas le respect du consommateur.	0
4745	comment écrire un critique négative sur un album solo d'eddie vedder quand on est fan (depuis plus de 10 ans.	0
4230	C'est triste de voir un CD comme çà se vendre.	0
2002	Voici pour cela une  bonne vieille recette qui marche toujours , prenez :  -pour  acteurs :des stars pour pré-ados tout mignons/mignonnes et tout gentils/gentilles , bien formatés, clonés plutôt vu qu'on trouve les mêmes dans tous ces trucs: zac Efron (High school musical), Robert Pattinson, kristen Stewart (Twilight),Jonas Brothers (camp rock), Miley Cyrus ici   -comme intrigue: .	0
1638	"excellent livre pour se transformer le temps d'un moment en une super maman bricoleuse!! bien expliqué, details et dessins tres pratiques!
 à acheter!!"	1
3933	Beowulf ou le bestseller des navets ... De grâce Monsieur Lambert arrêtez de jouer n'importe quoi !!!	0
691	Patrick Poivre D'Arvor, un homme que tout le monde connait qui présente le journal de 20h et que l'on pourrait croit insensible.	1
4201	Le jeune vainqueur de la Star Academy nous a offert un permier album assez honorable. Sa postérité était assurée.	0
3083	Grosse deception : Si la qualité des images est sans reproches, on ne peut pas en dire de même de la piste son.	1
3360	Un film qui manque de souffle et de rebondissements. Quelques très bonnes trouvailles compensent mal la lenteur du film.	0
4365	"Franchement, il ne suffit pas que la presse dise ""c'est bien"" pour que ça le soit."	0
2856	Par où commencer? Ce film est un véritable épitomé Hitchcockien  1.	1
1835	Des problèmes pour le cycle 3 mériterait d'être plus connu.	1
1477	Kate est une adolescente qui vit dans une banlieue calme et aseptisée de l'Ohio, nous faisons sa connaissance alors que sa mère vient de les quitter, elle et son père, sans un mot d'explication et sans rien emporter.	1
3634	Imaginez un croisement de Dom Camillo et de Mr Magoo qui est le seul à connaître la terrifiante vérité : la naissance de l'antéchrist est pour ce soir ! Notre héros n'a que quelques heures pour se rapprocher du malin, et pour un petit curé en soutane ce n'est pas simple.	1
1227	"Il manquait tout de même à l'auteur une vengeance plus directe et nous y avons droit avec ""Un Bon Petit Diable"": c'est qu'il était difficile à une fille de se révolter directement; le personnage de Pipi Langstrump, dont nous avons fait Fifi Brindacier, n'était pas encore là comme modèle."	1
544	Si effectivement le coté sixties est très interessant dans ce livre , pourquoi avoir ajouter une trame surnaturelle ( à la King , normal quoi) à la première partie et pas aux autres.	0
5384	"La ""musique"" est nulle ,les textes sont pitoyables."	0
4876	Dommage que ce groupe reste inconnu en France car c'est vraiment un tres bon groupe.	1
2011	Elle vous a bien plu, Kate Beckinsale, toute de cuir noir vêtue, dans les deux premiers opus, non?  Eh bien CE N'EST PAS ELLE qui joue dans Underworld 3! C'est Rhona Mitra!  Et l'éditeur sur la pochette du DVD cultive l'ambiguïté avec un culot qui frise l'arnaque : même silhouette, même combinaison noire, même cheveux brun.	0
4908	C'est vrai, on se retrouve en terrain connu car cet album n'a pas été pensé pour explorer d'autres voix que ce qui fut engagé avec le Suprême ni coller aux évolutions du rap qui se vend le plus et dont l'ancien compère Joey reste un étonnant exemple.	1
2889	"""John Q"" est un film magnifique et prenant du début jusqu'à la fin."	0
5738	One of the best Greek sounds combining lyrics from ancient texts and contemporary Greek poetry: sexy, erotic, poetic and lyrical.	1
2220	ce qui m'a fait acheter le dvd: Jason Statham, et les étoiles de mes prédécesseurs, mais, un je ne sais quoi, une intuition m'a suggéré de regarder le film en solo, l'abri des oreilles familiales, et c'est tant mieux!.	0
3210	La guerre entre les lycanthropes et les vampires est un thème intéressant car il permet la création d'un spectacle réjouissant.	1
3091	"Alphonso Cuaron (réalisateur) a réussi un film presque parfait mais le cangement de décor est un peu dommage et ayant lu le livre je trouve que le Quidditch aurai dû être plus ""présent dans le film"" et l'Eclair de Feu aurait dû arriver plus tôt."	1
4177	On sait, en France, depuis ses récitals au Palais Garnier et au Châtelet que Renée Fleming compose ses récitals avec soin et intelligence.	1
3951	je recherchais desepéremment les cds d'un de mes groupes favoris (qui se séparent.	1
486	"Cet auteur était un inposteur, ses livres, des contes de fées sans bases aucunes car lui-mème n'a eu que 6 vrais enfants autistes sous ses soins -dont d'ailleurs aucun n'a soi-disant été ""guéri""- on est loin des centaines de cas qu'il cite dans ce livre."	0
5022	Au regard de certains commentaires il semble évident qu'ils ne peuvent qu'être le reflet d'un manque de maturité voir d'ignorance.	0
760	Contrairement aux critiques dythirambiques sur ce dernier opus de Mme Cornwell, je ne saurais trop conseiller aux lecteurs éventuels de passer leur chemin, et réaliser par là-même de substantielles économies.	0
1709	C'est avec le même plaisir toujours renouvellé que l'on retrouve James Cagney et Gloria Parker Simmons dans une enquête qui les conduit aux confins de l'horreur humaine.	1
2347	"This is a unique movie with features and messages portrayed in ""Babette's Feast (1988)"" and ""Like Water for Chocolate (1993)""."	1
4424	"Ce double album n'est pas la bérézina ni le Titanic, mais on en est pas loin! déjà avec ""Close To The Edge"" on en approchait à grands pas!!! Eh oui, je fais partie de ces gens qui n'ont jamais accroché à ces 2 loukoums prétentieux (les fans de Yes appellent ça des 'Chef d'Oeuvre'!!!."	0
3963	Dvd instructif, sur un haînon manquant qui complète la trilogie sur la Terre des Dinosaures etc	0
1465	le dessin reste toujours aussi bien mais l'intrique sonne de plus en plus creux .	0
4971	Si vous aimez Good Charlotte, ce qui est mon cas depuis 5 ans, vous serez sans doute déçus par ce nouvel album.	0
2827	Les Tontons Flingueurs est véritablement un film culte.	1
3239	et bien c'est la belle et la bête, splendide comme toujours, un grand grand grand classique du cinema, jean marais époustouflant, une mise en scene de qui déjà ???? Alors forcément c'est 5 étoiles direct.	1
4787	Horreur, nous voilà revenus comme dans les pires heures du punk puisque, à nouveau, certaines maisons de disque semblent trouver intéressant de signer des groupes (comme celui-ci, mais il y en a d'autres.	0
2681	Concernant le documentaire lui-même, c'est bien sûr d'une expérience superbe que de voir le monde à cette échelle-là, si étrange et si beau.	0
660	Habitant en Allemagne, je connais très bien ce livre qui fait partie des classiques pour les enfants de maternelle.	1
4588	Nous connaissions déjà le Villazon qui nous écorchait le Combattimento de Monteverdi et on aurait pensé que ce serait sa seule escapade baroque.	0
772	Un style pénétrant et une narration limpide : on vit avec l'ancien étudiant Raskolnikov dès la première page.	1
4984	Album tout à fait conforme au film , excellent et tonique .	1
5870	Cet album qui est le companion d'un show télévisé de Streisand dans les années 70, n'aurait jamais du être édité.	0
5931	"""Down In The Groove"" est le 25è album studio de Bob Dylan, il a été enregistré en avril et mai 1987 et a été publié le 31 mai 1988."	0
1045	Un sage donne des leçons d'amour.	0
2171	Ce film m'a beaucoup plu.	1
3699	Lorsque j'ai vu ce documentaire-fiction pour la première fois il était présenté en épisodes 6 ou 9 au total, je ne sais malheureusement plus.	1
1735	J'ai beaucoup apprécié ce livre sérieux qui apporte des éléments intéressants pour comprendre la Bible et la démythifier et j'aimerais bien savoir qui sont ces auteurs qui se disent hébraïsants mais qui ne semblent pas très bien connaître la Bible.	1
2040	Voilà, je suis tout simplement dégouté, après avoir acheté ce coffret DVD sur Amazon je me retrouve avec de DVD illisibles sur lecteur DVD salon et sur PC autant un HP pavillon très jeune qu'un PC de 2000.	0
2743	La copie du film est particuliérement mauvaise mais le film lui-même baigne dans une atmosphére morbide, autant musicale que visuelle.	0
4670	Surprenant de voir que ce cd n'a pas encore été commenté, car il est très réussi.	1
849	Un gros ouvrage, mais qu'on lit sans jamais regarder le numéro en bas de la page.	1
4708	"J'ai toujours trouvé ""Fragile"" et ""Yes Album"" trop sages : les 2 disques contiennent des morceaux en devenir, qui prennent toute leur dimension dans ce live."	1
1072	Je préfets indiquer qu'il s'agit de la suite de l'énigme sacrée, ce livre a un titre bien à lui, « le message » Les différents thèmes abordés sont les suivants : Le messie, les mérovingiens, l'ordre de Malte, le roi perdu, Rennes le château, le prieuré de Sion.	0
3802	Une histoire qui remonte l'estomac et fais bruler les neurones.	1
1794	Un petit livre sans prétention mais bien pratique, utile pour tous ceux qui n'ont pas forcément une piscine olympique et qui ne sont pas forcément des athlétes.	1
3772	S'il n'est pas le plus connu du réalisateur, ce film est sans doute le plus beau et le plus intime qu'il ait jamais tourné.	1
3485	Un film dont il ne faut surtout pas manquer la première scène, un plan séquence d'une dizaine de minutes comme on en voit rarement, à la poursuite d'un Nicolas Cage déambulant dans les couloirs d'un stade.	1
3946	Un film qui plait aux filles, sympathique, bien joué.	1
5267	En apprenant la sortie imminente de cet album, je me suis dit : mouais.	1
5265	Enfin le concert complet avec le retour de Gary au chant qui s'en tire plutôt pas mal en remplacement de Graham Bonnet.	1
1542	Excellent sur le fond, cette présentation des 3 premiers volumes des rois maudits est aussi très bien sur la forme et à un prix extra .	1
2059	Il y a un début à tout.	1
112	Que dire? C'est le seul livre qui m'aie fait pleurer.	1
5597	Ici pas de dub, mais de superbes morceaux de reggae roots, soutenus par un groupe impeccable (la basse de Boris Gardiner !.	0
2196	Il y a des films comme Ã§a qui vous arrivent en pleine figure et qui vous assomment par leur justesse, leur sensibilitÃ©.	1
4468	Je n'ai peut-être pas bien écouté, je n'en sais rien, mais ce genre, bien que je sois ouvert, ne me fait rien du tout.	0
